,TM2023003966,17 February 2023,,,"Disclaimer: the words ""cheltenham"", ""college"" and the latin words ""labor omnia vincit"" separately. Printed matter; Instructional and teaching materials; Educational materials for teaching purposes [except apparatus]; Informational materials for teaching purposes [except apparatus]; Stationery and office requisites, except furniture; Books; Booklets; Educational books; Educational publications; Workbooks [study guides]; Dictionaries; Reference books; Software programs and data processing programs in printed form; Blueprints; Bulletins [printed matter]; Magazines [periodicals]; Annuals [printed publications]; Calendars; Flash cards [teaching materials]; Printed research reports; Quick reference pocket guides [printed matter]; Handbooks [manuals]; Newsletters; Journals [publications]; Catalogues; Circulars; Data books; Diaries; Bookmarkers; Informational sheets; Instruction sheets; Printed questionnaires; Printed seminar notes; Printed survey answer sheets; Printed teaching materials; Printed training materials; Printed visuals; Printing paper; Paper teaching materials; Printed instructional materials; Stickers; Advertisement boards of paper or cardboard; Announcement cards; Events programs; Flyers; Forms; Plastic sheets, films",,
,TM2023003968,17 February 2023,,,"Disclaimer: the chinese characters ""qiao ting han"" and ""gong xue"" separately. Printed matter; Instructional and teaching materials; Educational materials for teaching purposes [except apparatus]; Informational materials for teaching purposes [except apparatus]; Stationery and office requisites, except furniture; Books; Booklets; Educational books; Educational publications; Workbooks [study guides]; Dictionaries; Reference books; Software programs and data processing programs in printed form; Blueprints; Bulletins [printed matter]; Magazines [periodicals]; Annuals [printed publications]; Calendars; Flash cards [teaching materials]; Printed research reports; Quick reference pocket guides [printed matter]; Handbooks [manuals]; Newsletters; Journals [publications]; Catalogues; Circulars; Data books; Diaries; Bookmarkers; Informational sheets; Instruction sheets; Printed questionnaires; Printed seminar notes; Printed survey answer sheets; Printed teaching materials; Printed training materials; Printed visuals; Printing paper; Paper teaching materials; Printed instructional materials; Stickers; Advertisement boards of paper or cardboard; Announcement cards; Events programs; Flyers; Forms; Plastic sheets, films and bags for wrapping and packaging; Packaging materials of paper; School yearbooks; Business cards; Brochures; School supplies [stationery]; Office stationery; Stationery cases; Stationery folders; Stationery writing paper and envelopes; Stationery-type portfolios; Stickers [stationery]; Wrappers [stationery]; Writing cases [stationery]; Writing paper and envelopes [stationery]; Writing instruments; Pencils; Ballpoint pens; Drawing instruments; Notebooks; Adhesive tapes for stationery purposes; Three-dimensional models for educational purposes. CHELTENHAM COLLEGE INTERNATIONAL LIMITED ; Cheltenham College, Bath Road, Cheltenham, Gloucestershire, GL53 7LD, UNITED KINGDOM Property Sdn Bhd, A-39-10, Penthouse, Menara UOA Bangsar, No. 5, Jalan Bangsar Utama 1, Bangsar, 59000 Kuala Lumpur",,"Mohana Murali A/L Kodivel, Adastra Intellectual Property Sdn Bhd, A-39-10, Penthouse, Menara UOA Bangsar, No. 5, Jalan Bangsar Utama 1, Bangsar, 59000"
,TM2023003970,17 February 2023,,,"Disclaimer: the words ""cheltenham"" and ""college"" separately. Printed matter; Instructional and teaching materials; Educational materials for teaching purposes [except apparatus]; Informational materials for teaching purposes [except apparatus]; Stationery and office requisites, except furniture; Books; Booklets; Educational books; Educational publications; Workbooks [study guides]; Dictionaries; Reference books; Software programs and data processing programs in printed form; Blueprints; Bulletins [printed matter]; Magazines [periodicals]; Annuals [printed publications]; Calendars; Flash cards [teaching materials]; Printed research reports; Quick reference pocket guides [printed matter]; Handbooks [manuals]; Newsletters; Journals [publications]; Catalogues; Circulars; Data books; Diaries; Bookmarkers; Informational sheets; Instruction sheets; Printed questionnaires; Printed seminar notes; Printed survey answer sheets; Printed teaching materials; Printed training materials; Printed visuals; Printing paper; Paper teaching materials; Printed instructional materials; Stickers; Advertisement boards of paper or cardboard; Announcement cards; Events programs; Flyers; Forms; Plastic sheets, films and bags for wrapping and packaging; Packaging materials of paper; School yearbooks; Business cards; Brochures; School supplies [stationery]; Office stationery; Stationery cases; Stationery folders; Stationery writing paper and envelopes; Stationery-type portfolios; Stickers [stationery]; Wrappers [stationery]; Writing cases [stationery]; Writing paper and envelopes [stationery]; Writing instruments; Pencils; Ballpoint pens; Drawing instruments; Notebooks; Adhesive tapes for stationery purposes; Three-dimensional models for educational purposes. CHELTENHAM COLLEGE INTERNATIONAL LIMITED ; Cheltenham College, Bath Road, Cheltenham, Gloucestershire, GL53 7LD, UNITED KINGDOM Property Sdn Bhd, A-39-10, Penthouse, Menara UOA Bangsar, No. 5, Jalan Bangsar Utama 1, Bangsar, 59000 Kuala Lumpur",,"Mohana Murali A/L Kodivel, Adastra Intellectual Property Sdn Bhd, A-39-10, Penthouse, Menara UOA Bangsar, No. 5, Jalan Bangsar Utama 1, Bangsar, 59000"
,TM2023006969,9 March 2023,,,"Paper labels; Paper cartons for delivering goods; Photographs [printed]; Forms, printed; Printed manuals; Printed menus; Printed vouchers; Printed books; Printed graphs; Printed guides; Printed informational sheets; Printed leaflets; Printed matter; Printed plans; Printed publications; Printed reports; Directories [printed matter]; Annuals [printed publications]; Printed booklets; Printed charts; Printed certificates; Printed brochures; Printed calendars; Printed cards; Printed handbooks; Printed flyers; Plastic materials for packaging; Labels made of paper; Stickers; Clothing patterns; Printed patterns for making clothes; Instructional and teaching materials. YFS CORPORATE (M) SDN. BHD. ; Lot 58904, Jalan Pekeliling Tanjung 27/2, Kawasan Perindustrian Indahpura, 81000 Kulai, Johor, MALAYSIA Bhd. No. 3A-08, Hab Citrine, Persiaran Medini 3, Bandar Medini Iskandar, 79250 Iskandar Puteri, Johor",,"Low Chee Keong, IPMAN Global Intellect Sdn. Bhd. No. 3A-08, Hab Citrine, Persiaran Medini 3, Bandar Medini Iskandar, 79250 Iskandar Puteri, Johor"
,TM2025005449,24 February 2025,,,"Paper and cardboard; Stationery; Printing paper; Writing paper; Drawing paper; Typewriter paper; White paperboard; Postcard paper; Tissue paper; Paper tissues; Paper for photocopying; Photocopying paper; Facsimile transmission paper; Letter paper; Drawing tablets [drawing pads]; Paper note tablets; Writing tablets; Loose leaf paper; Notebooks; Sketchbooks; Exercise books; Writing pads; Carbonless copy paper; Carbonless paper; Adhesive note pads; Note pads; Paper file jackets; Document files; Letter files; Envelopes; Account books; Ruled paper; Pocket books [stationery]; Memo pads; Paper for wrapping and packaging; Wrapping paper; Packaging materials of paper; Tissues of paper; Copying paper. APRIL INTERNATIONAL ENTERPRISE PTE. LTD. ; 80 Raffles Place #50-01 UOB Plaza 1, SINGAPORE 048624 Jalan Burma, 10350 Georgetown, Pulau Pinang",,"Isaac Stephen Huang, 368-3-1& 2, Belissa Row, Jalan Burma, 10350 Georgetown, Pulau Pinang"
,TM2025012323,18 April 2025,,,"Books; Flyers; Stickers; Activity books; Advertising pamphlets; Bookbinding materials; Booklets; Children's interactive educational books; Educational books; Educational materials for teaching purposes [except apparatus]; Educational publications; Note books; Paper sheets [stationery]; Printed brochures; Printed certificates; Printed flyers; Printed leaflets; Printed matter, stationery and educational supplies; Study guides; Training manuals; Workbooks [study guides]; Stationery; Labels of paper or cardboard. LMS EDUCATION HOLDINGS SDN. BHD. ; 12-3A, 2 Rio Tower, Persiaran Rio Bandar Puteri, 47100 Puchong, Selangor, MALAYSIA KL Gateway, No. 2, Jalan Kerinchi, 59200 Kuala Lumpur",,"Brenda Lee Wen Yi, D-25-03, Menara Suez Cap 1, KL Gateway, No. 2, Jalan Kerinchi, 59200 Kuala Lumpur"
,TM2025013921,30 April 2025,,,"representation on the form of application. The translation of the arabic script of which the mark consist of is “camel step”. The transliteration of the arabic script of which the mark consist of is “khutwa jamal”. Absorbent sheets of paper or plastic for foodstuff packaging; Advertisement boards of paper or cardboard; Bags [envelopes, pouches] of paper or plastics, for packaging; Baking paper; Banners of paper; Booklets; Books; Bottle envelopes of paper or cardboard; Bottle wrappers of paper or cardboard; Boxes of paper or cardboard; Coasters of paper; Garbage bags of paper or of plastics; Handkerchiefs of paper; Labels of paper or cardboard; Magazines [periodicals]; Origami folding paper; Packaging material made of starches; Paper wipes for cleaning; Parchment paper; Pictures; Placards of paper or cardboard; Table napkins of paper; Trading cards, other than for games; Wrapping paper; Packing paper. CAMEL STEP TRADING COMPANY ; Hay Al Ta’awun, Tariq Abi Baker Al Siddiq Al Far’I, 6016, 13313, 8169641, Riyadh, SAUDI ARABIA Consulting and Training Sdn. Bhd., E-08-09, Bangsar Trade Centre, Off Jalan Pantai Baharu, 59200 Kuala Lumpur",,"Nur Atiqah Bt Samian, TAG Intellectual Property Consulting and Training Sdn. Bhd., E-08-09, Bangsar Trade Centre, Off Jalan Pantai Baharu, 59200 Kuala Lumpur"
,TM2025014462,7 May 2025,,,"Packing materials of paper; Packing materials of cardboard; Plastic materials for packaging; Cushioning materials of paper or cardboard; Photographs [printed]; Printed advertising boards of paper or cardboard; Printed art reproductions; Printed brochures; Printed flyers. NX HOLDINGS BERHAD; 9-B3 City Garden Commercial Centre, Taman Nirwana Ampang, 68000 Ampang, Selangor, MALAYSIA Damansara, Jalan Damansara, Taman Tun Dr Ismail, 60000 Kuala Lumpur",,"Chong Yu Bin, PRIMUS IP Sdn Bhd,  13A-01, Oval Damansara, Jalan Damansara, Taman Tun Dr Ismail, 60000"
,TM2025014466,7 May 2025,,,"Packing materials of paper; Packing materials of cardboard; Plastic materials for packaging; Cushioning materials of paper or cardboard; Photographs [printed]; Printed advertising boards of paper or cardboard; Printed art reproductions; Printed brochures; Printed flyers. NX HOLDINGS BERHAD; 9-B3 City Garden Commercial Centre, Taman Nirwana Ampang, 68000 Ampang, Selangor, MALAYSIA Damansara, Jalan Damansara, Taman Tun Dr Ismail, 60000 Kuala Lumpur",,"Chong Yu Bin, PRIMUS IP Sdn Bhd,  13A-01, Oval Damansara, Jalan Damansara, Taman Tun Dr Ismail, 60000"
,TM2025014813,8 May 2025,,,"representation on the form of application. As a whole which has no meaning Paper*; Toilet paper; Paper handkerchiefs; Paper napkins; Paper towels; Wrapping paper; Facial tissues of paper; Paper tissues for removing cosmetics; Paper board; Corrugated paper; White paperboard; Printing paper; Gummed paper; Boxes of paperboard; Offset paper; Newsprint paper; Laser print paper; Electrostatic paper; Copy paper; Cardboard*. No. 288, Xiating, Tingli Village, Chihu Town, Zhangpu County, Zhangzhou City, Fujian Province, 363000, CHINA PLT; No.1-9-13, Block Chempaka, Taman Desaminium, Jalan Flora, 43300 Seri Kembangan, Selangor","LIANSHENG PULP & PAPER (ZHANGZHOU) CO., LTD. ;","Vannesse Lee Pei Eng, Drexworld Management PLT; No.1-9-13, Block Chempaka, Taman Desaminium, Jalan Flora, 43300 Seri Kembangan, Selangor"
,TM2021000166,5 January 2021,,,"Beach bags, all-purpose sport bags, backpacks, book bags, sports bags, bum bags, wallets and handbags, shoulder bags, waist packs, yoga bags. BODY GLOVE IP HOLDINGS LP ; 50 West 57th Street, 5th Floor, New York, NY 10019, UNITED STATES OF AMERICA Co. 7th. Floor, Wisma Hamzah-Kwong Hing No. 1, Leboh Ampang, 50100 Kuala Lumpur BODY GLOVE",,"Indran A/L Shanmuganathan, Shearn Delamore & Co. 7th. Floor, Wisma Hamzah-Kwong Hing No. 1, Leboh Ampang, 50100 Kuala Lumpur"
18,TM2021035895,22 December 2021,,,"Beach bags, all-purpose sport bags, backpacks, book bags, sports bags, bum bags, wallets and handbags, shoulder bags, waist packs, yoga bags. Sporting goods, namely, paddle boards, surf boards, stand-up paddle boards, skateboards, swim fins, fins for body boards, surf fins, scuba fins, body boards, restraint straps for body boards, surfboard leashes, bags especially designed for surfboards, bags for skateboards. Retail store services and online retail store services in the sale of apparel, bags, eyewear, sporting goods, perfumes, body oils, body lotions, watches. BODY GLOVE IP HOLDINGS LP ; 50 West 57th Street, 5th Floor, New York, NY 10019, UNITED STATES OF AMERICA Hing No. 1, Leboh Ampang, 50100 Kuala Lumpur",,"Indran A/L Shanmuganathan, Shearn Delamore & Co. 7th. Floor, Wisma Hamzah-Kwong Hing No. 1, Leboh Ampang, 50100 Kuala Lumpur"
,TM2022019221,28 July 2022,,,"meaning. Fur; Rucksacks; Trunks [luggage]; Bags for campers; Bags for climbers; Pocket wallets; Shopping bags; Key cases; Sport bags; Tote bags; Furniture coverings of leather; Reins for guiding children; Umbrellas; Umbrella covers; Umbrella handles; Umbrella or parasol ribs; Parasols; Umbrella rings; Walking sticks; Collars for animals; Clothing for pets. SHENZHEN JANEZ TECHNOLOGY CO., LTD. ; Room 1405, HanKing Financial Centre, No. 9968 Shennan Road, Maling Community, Yuehai Street, Nanshan District, Shenzhen, CHINA SUEZCAP 1, KL Gateway No. 2, Jalan Kerinchi, Gerbang Kerinchi Lestari, 59200 Kuala Lumpur",,"Tai Foong Lam, Gan Partnership D-32-02, Menara SUEZCAP 1, KL Gateway No. 2, Jalan Kerinchi, Gerbang Kerinchi Lestari, 59200 Kuala Lumpur"
,TM2025012098,17 April 2025,,,"Leather and imitation leather; Leather bags and wallets; Leather briefcases; Leather suitcases; Leather wallets; Bags of leather; Handbags made of leather; Travel bags; work bags; Purses [leatherware]; Backpacks; Belt bags; All- purpose sports bags; Athletics bags; Cross-body bags; Duffel bags; Hip bags; School bags. LIU YANING ; Floor 7, Unit 3, Building 28, Gelin Chuntian Community, Shaodong City, Shaoyang City, Hunan Province, CHINA 10, Vertical Business Suites, No. 8, Jalan Kerinchi, Bangsar South, 59200 Kuala Lumpur",,"Phoon Chiy Hin , c/o CH Phoon & Associates, A-3- 10, Vertical Business Suites, No. 8, Jalan Kerinchi, Bangsar South, 59200 Kuala Lumpur"
18,TM2025012589,22 April 2025,,,"Rucksacks; Moleskin [imitation of leather]; Cattle skins; Boxes of leather or leatherboard; Shoulder belts [straps] of leather; Bags for sports*. Cups. Hosiery; Socks; Hats; Waistcoats; Money belts [clothing]. SENOVO INTERNATIONAL LIMITED ; RM A07，1701-02 New Trend Centre,704 Prince Edward Rd East,San Po Kong, 999077, HONG KONG PLT; No.1-9-13, Block Chempaka, Taman Desaminium, Jalan Flora, Seri Kembangan 43300 Selangor",,"Vannesse Lee Pei Eng, Drexworld Management PLT; No.1-9-13, Block Chempaka, Taman Desaminium, Jalan Flora, Seri Kembangan 43300 Selangor"
,TM2025014173,5 May 2025,,,"All purpose sports bags; Athletic bags; Backpacks; Bags for sports clothing; Bags made of imitation leather; Belt bags and hip bags; Belt pouches; Canvas bags for shopping; Children's shoulder bags; Cross-body bags; Gym bags; Hiking bags; Knapsacks; Leather and artificial leather; Leisure bags; Luggage, bags, wallets and carrying bags; Men's bags; School backpacks; School bags; Shoulder bags; Shoe bags for travel; Small backpacks; Sports bags; Toiletry bags sold empty; Travelling bags; Trolley bags; Umbrellas; Waist bags; Waist pouches; Wallets; Woven bags. SIM HEE PANG ; UOB Tower, CT960, Level 9, Block C, Icom Square, Jalan Pending, 93450 Kuching, Sarawak, MALAYSIA",Overnight bags; Pouches; Reusable merchandise bags;,
,TM2025014548,7 May 2025,,,"Bags; Backpacks; Purses; Handbags; Clutch bags; Trunks being luggage; Key cases; Pouches for holding make-up, keys and other personal items; Travelling bags [leatherware]; Duffel bags; All purpose sports bags; Canvas shopping bags; Luggage organizers; Umbrellas; Leather; Clothing for pets; Bags for carrying pets; Backpacks for carrying infants; Pouch baby carriers; Luggage tags. BLANK SPACE MARKETING CO., LTD. ; 10F-2, No. 36, Sec. 1, Zhonghua Rd., Tucheng Dist., New Taipei City 236029, Taiwan, TAIWAN (PROVINCE OF CHINA) The Boulevard, Mid Valley City, Lingkaran Syed Putra, Kuala Lumpur 59200 TRIXSTAR",,"Quah Su Yee, ACCOLADE IP (M) SDN BHD., 3-8, The Boulevard, Mid Valley City, Lingkaran Syed Putra, Kuala"
18,TM2025014934,9 May 2025,,,"Bags; Bags for sports; Handbags; Backpacks; Trunks [luggage]; Harness straps. Clothing; Clothing for gymnastics; Footwear; Gymnastic shoes; Uniforms; Headwear; Sports jerseys; Sports shoes; Sportswear incorporating digital sensors; Beach clothes. AREA 1 PTY LTD ; PO BOX 1759 Warriewood Shopping Square WARRIEWOOD NSW 2102, AUSTRALIA Level 35-02, East Wing, Q-Sentral 2A, Jalan Stesen Sentral 2, 50470 Kuala Lumpur",,"Hemamaliny A/P K. Supramania Pillay, The IP Co. Level 35-02, East Wing, Q-Sentral 2A, Jalan Stesen Sentral 2, 50470 Kuala Lumpur"
,TM2020003257,20 February 2020,,,"Building materials, not of metal; Construction materials, not of metal; Wood panelling; Refractory construction materials, not of metal; Framework, not of metal, for building; Mouldings, not of metal, for building; Moldings, not of metal, for building; Wooden floor boards; Ceilings, not of metal; Partitions, not of metal; Building panels, not of metal; Plywood. ELITACO SDN. BHD. ; No. 59 & 61, Jalan Mutiara Emas 5/1, Taman Mount Austin, 81100 Johor Bahru, Johor, MALAYSIA Bhd. No. 19, Jalan SS1/36, 47300 Petaling Jaya, Selangor",,"Lok Choon Hong, Pintas Consulting Group Sdn. Bhd. No. 19, Jalan SS1/36, 47300 Petaling Jaya, Selangor"
19,TM2025010320,3 April 2025,,,"Boards of wood; Building materials of wood; Decking boards of wood; Floorboards of wood; Wood boards; Wooden doors; Wooden floorboards; Wooden flooring. Kitchen cabinets; Wardrobes; Door furniture made of wood; Doors made of wood for furniture; Doors of wood for furniture; Outdoor furniture of wood; Wooden doors for furniture; Furniture made of wood; Furniture of wood; Garden furniture made of wood; Garden furniture of wood; Lawn furniture made of wood; Lawn furniture of wood; Patio furniture of wood; Vanity tables; Bathroom vanities [furniture]; Bathroom vanities being furniture. MY RAINTREE SDN. BHD. ; Lot A-1-6 Damai Hillpark, Jalan Damai Perdana 6/1F, Bandar Damai Perdana, 56000 Cheras Selangor, MALAYSIA Uncang Emas (UE3), 85, Jalan Loke Yew, 52200 Kuala Lumpur",,"Chia Wilson, Block C-7-5 & C-7-8 Level 7),  Menara Uncang Emas (UE3), 85, Jalan Loke Yew, 52200 Kuala"
,TM2025013386,28 April 2025,,,"Ceramic tiles for walls, floors and ceilings; Non-metallic tiles for building; Building materials, non-metallic; Building stone; Mosaics for building; Marble; Terracotta floor tiles; Non-metal floor tiles; Slate. NCM WORLDWIDE MARKETING SDN. BHD. ; No. 97, Jalan 5/62A, Bandar Menjalara, 52200 Kepong, Kuala Lumpur, MALAYSIA Block C, Jalan Dataran SD 1 Dataran SD PJU 9, Bandar Sri Damansara, 52200 Kuala Lumpur",,"Yip Jiun Hann, TRADEMARK2U Sdn Bhd No. 1, Block C, Jalan Dataran SD 1 Dataran SD PJU 9, Bandar Sri Damansara, 52200 Kuala Lumpur"
,TM2025014914,9 May 2025,,,"No colour claim. Bricks; Mosaics for building; Ceramic tiles; Wooden floor tiles; Tiles, not of metal, for building; Wall tiles, not of metal, for building; Artificial stone; Pantiles, not of metal; Marble; Quartz; Building panels, not of metal; Floor panels, not of metal; Ceiling panels, not of metal; Door panels, not of metal; Non-metal facade panels for construction purposes; Glass panels for building. L T L CORPORATION SDN BHD ; 130, Persiaran Raja Muda Musa, Jalan Teluk Gadong, 41200 Klang, Selangor, MALAYSIA Remia 2/KS6, Bandar Botanic, 41200 Klang, Selangor DENISH",,"Young Seow Yen, Yeo & Young, No. 7, Jalan Remia 2/KS6, Bandar Botanic, 41200 Klang, Selangor"
,TM2023010249,12 April 2023,,,"Arm chairs; Lawn chairs; Chairs [seats]; Desks; Cupboards; Wardrobes; Sofas; Bean bag chairs; Bean bag pillows; Showcases [furniture]; Coffee tables; End tables; Side tables; Dining tables; Dining chairs; Motion chairs; Lounge chairs; Ottomans; Work benches; Liquid storage tanks, not of metal or masonry; Liquid storage reservoirs, not of metal or masonry; Industrial water storage tanks, not of metal or masonry; Gas storage tanks, not of metal or masonry; Valves of plastic, other than parts of machines; Curtain rings; Curtain rods; Curtain rollers; Curtain tie-backs; Curtain hooks; Clamps, not of metal; Clips, not of metal, for cables; Clips, not of metal, for pipes; Door fasteners, not of metal; Window fasteners, not of metal; Sash fasteners, not of metal, for windows; Brackets, not of metal, for furniture; Nails, not of metal; Wedges, not of metal; Nuts, not of metal; Screws, not of metal; Tacks, not of metal; Bolts, not of metal; Rivets, not of metal; Casters, not of metal; Washers, not of metal; Washers of plastic; Locks, non-electric, not of metal; Industrial packaging boxes of wood; Industrial packaging boxes of bamboo; Japanese food wrapping sheets of plastics [Kyogi]; Cork stoppers for bottles; Plastic stoppers for bottles; Plastic lids for industrial packaging containers; Plastic covers for industrial packaging containers; Wooden stoppers for bottles; Wooden lids for industrial packaging containers; Wooden covers for industrial packaging containers; Loading pallets, not of metal; Beehives [hive boxes or honeycombs]; Cushions; Japanese floor cushions[Zabuton]; Pillows; Mattresses, not for medical purposes; Beds for household pets; Dog kennels; Nesting boxes for small birds; Fans for personal use, non-electric; Hand-held folding fans; Shopping baskets [not of metal]; Picture frames; Water tanks for household purposes, not of metal or masonry; Step ladders, not of metal; Ladders, not of metal; Tool boxes, not of metal, empty; Embroidery frames and hoops; Stakes, not of metal, for plants or trees; Blinds of reed [Sudare]; Blinds of rattan [Sudare]; Blinds of bamboo [Sudare]; Bead curtains for decoration; Towel dispensers, not of metal; Oriental single panel standing partition [furniture]; Oriental folding partition screens [furniture]; Nameplates, not of metal; Door nameplates, not of metal; Hand- Benches[furniture]; Hat hooks, not of metal; Mannequins; Costume display stands; Straw plaits; Inflatable publicity objects; Upright signboards of wood; Upright signboards of plastic; Letter boxes [not of metal or masonry]; Cradles; Infant walkers; Hairdresser's chairs; Barbers' chairs; Plaster sculptures; Plastic sculptures; Wooden sculptures; Reeds [plaiting materials]; Rushes [plaiting materials]; Onigaya hay[plaiting materials]; Sedges [plaiting materials]; Wheat straw [plaiting materials]; Barley straw [plaiting materials]; Oat straw [plaiting materials]; Rice straw [plaiting materials]; Japanese food wrapping sheets of wood as materials [Kyogi]; Ferns [plaiting materials]; Bamboo, unworked; Bamboo, semi-worked; Bamboo skins [plaiting materials]; Vines [plaiting materials]; Rattan; Tree barks, unworked; Tree barks, semi-worked; Tusks, unworked; Tusks, semi-worked; Whalebones; Shells and crusts; Artificial horns; Ivory, unworked; Ivory, semi-worked; Animal horns; Animal teeth; Tortoiseshells, unworked; Tortoiseshells, semi-worked; Animal bone, unworked; Animal bone, semi- worked; Coral, unworked; Coral, semi-worked; Meerschaum, unworked; Meerschaum, semi-worked;","held flagpoles, not of metal; Hanging boards [Japanese style pegboards using positional hooks];",
,TM2025012339,18 April 2025,,,"exclusive use of the word ""furniture"". Furniture partitions of wood; Fitted fabric furniture covers; Brackets, not of metal, for furniture; Chairs; Towel closets [furniture]; Furniture; Indoor furniture; Household furniture; Living room furniture; Furniture panels; Furniture parts; Legs for furniture; Wooden furniture; Wooden shelving (furniture); Cabinets [furniture]; Dining room furniture; Furniture for kitchen. STEP FURNITURE MANUFACTURER SDN. BHD. ; Lot 102 & 103, Jalan Perusahaan Lima, Taman Perindustrian Mahkota, 43700 Beranang, Selangor, MALAYSIA Seng, 203, Jalan Bukit Bintang, 55100 Kuala Lumpur",,"Cheah Jo Yi, Suite 33-01, 33rd Floor, Menara Keck Seng, 203, Jalan Bukit Bintang, 55100 Kuala Lumpur"
,TM2025013596,29 April 2025,,,"Desks; Office furniture; Furniture; Filing cabinets; Chairs [seats]; Hat stands; Counters [tables]; Tables*; Racks [furniture]; Flower-stands [furniture]; Furniture of metal; Shelves for storage; Tea tables; Display stands. HUANG CHENGFANG ; A-3-8 & A-3-9, Level 3, Empire Tower, Empire Subang, Jalan SS16/1, 47500 Subang Jaya, Selangor, MALAYSIA Hall Road, 10050 Georgetown, Pulau Pinang",,"Liang Pey Huey , C/O IPON9 Sdn. Bhd., 7A Clove Hall Road, 10050 Georgetown, Pulau Pinang"
,TM2025013597,29 April 2025,,,"Desks; Office furniture; Furniture; Filing cabinets; Chairs [seats]; Hat stands; Counters [tables]; Tables*; Racks [furniture]; Flower-stands [furniture]; Shelves for storage; Tea tables; Furniture of metal; Display stands. HUANG CHENGFANG ; A-3-8 & A-3-9, Level 3, Empire Tower, Empire Subang, Jalan SS16/1, 47500 Subang Jaya, Selangor, MALAYSIA Hall Road, 10050 Georgetown, Pulau Pinang",,"Liang Pey Huey , C/O Ipon9 Sdn. Bhd., 7A Clove Hall Road, 10050 Georgetown, Pulau Pinang"
