Class Index,Serial Number,Application Date,International Priority Date,By Consent Trademark Numbers,Description,Company Name,Agent Details
11,TM2019034151,17 September 2019,,,"STRIKER ELECTRIC (SABAH) SDN BHD ; No.107, Jalan 2/149g, Taman Sri Endah, 57000 Kuala Lumpur, MALAYSIA Office Ekocheras Office Suites, 693, Jalan Cheras, Batu 5, 56000 Cheras, Kuala Lumpur",,"Tee Lin Yik, Tee IP Sdn Bhd,  A-23-01, Penthouse Office Ekocheras Office Suites, 693, Jalan Cheras, Batu 5, 56000 Cheras, Kuala Lumpur"
16,TM2019046802,18 December 2019,,,"Advertisement boards of paper or cardboard; blackboard; blotters, blueprints, bookbinding apparatus and machines, books, catalogues, comic books, magazines [periodicals]; printed matter, printed publications, printing blocks; all LAW KIAN LAI ; No.40, Jalan Utama 26, Taman Mutiara Rini 81300 Skudai, Johor, MALAYSIA Mutiara Rini, 81300 Skudai, Johor",,"Loo Nic Kee, No. 40, Jalan Utama 26 Taman Mutiara Rini, 81300 Skudai,  Johor"
21,TM2019047229,20 December 2019,,,"Tableware, other than knives, forks and spoons; Chopsticks; Glassware for household purposes; Chinaware; China ornaments; Tea services [tableware]; Straws for drinking; Boxes for dispensing paper towels; Combs; Toothbrushes; Toothpicks; Cosmetic utensils; Thermally insulated containers for food; Portable cool boxes, non-electric; Isothermic bags; Cloths for cleaning; Crystal [glassware]; Drinking troughs; Indoor aquaria; Insect traps; Drinking vessels; Vacuum bottles; Heat-insulated containers; All RAJAX NETWORK & TECHNOLOGY (SHANGHAI) CO., LTD. ; Room 507, No. 788 Zhenbei Road, Putuo District, Shanghai, CHINA 23rd Floor, Surian Tower, No. 1 Jalan PJU 7/3, Mutiara Damansara, 47810 Petaling Jaya, Selangor 2018071201 12 October 2018 It is a condition of registration that the device or devices of cross appearing in the mark shall not be used in the colour red or white on a red background or silver on a red background or in any similar colour or colours. Cleaning of blast furnaces, incineration installations, using explosion procedures, particularly gas explosion procedures; BANG & CLEAN GMBH ; Bünzweg 15, 5504 Othmarsingen, SWITZERLAND Caroline Sha & Syah, Level 31, Menara TH Perdana 1001, Jalan Sultan Ismail, 50250 Kuala Lumpur",,"Tan Sin Su, Quality Oracle Sdn. Bhd.; Unit 23.3, 23rd Floor, Surian Tower, No. 1 Jalan PJU 7/3, Mutiara Damansara, 47810 Petaling Jaya, Selangor"
43,TM2018016397,7 December 2018,"11 September 2018,",,"Japan Providing foods and beverages; Providing foods and beverages mainly for yakiniku cuisine; Providing information about providing foods and beverages mainly for yakiniku DINING INNOVATION LTD. (KABUSHIKI KAISHA DINNING INNOVATION) ; Ebisuminamil-11-2, Shibuya-Ku, Tokyo, JAPAN Wisma UOA Damansara 50 Jalan Dungun, Damansara Heights, 50490 Kuala Lumpur",,"Teh Hong Koon, Skrine Unit No. 50-8-1, 8th. Floor, Wisma UOA Damansara 50 Jalan Dungun, Damansara Heights,  50490 Kuala Lumpur"
43,TM2018016395,7 December 2018,"10 August 2018, Japan",,"The transliteration and translation of the japanese characters appearing in the mark is ""yakiniku"", ""raiku"" meaning ""japanese dish of grill meat"", ""like"" Providing foods and beverages; Providing foods and beverages mainly for yakiniku cuisine; Providing information about providing foods and beverages mainly for yakiniku DINING INNOVATION LTD. (KABUSHIKI KAISHA DINNING INNOVATION) ; Ebisuminamil-11-2, Shibuya-Ku, Tokyo, JAPAN 8th Floor, Wisma UOA Damansara, 50 Jalan Dungun, Damansara Heights, 50490 Kuala Lumpur",,"Charmayne Ong Poh Yin, Skrine; Unit No. 50-8-1, 8th Floor, Wisma UOA Damansara, 50 Jalan Dungun, Damansara Heights, 50490 Kuala Lumpur"
43,TM2018019433,31 December 2018,,,"2015065552. The transliteration of the chinese characters appearing in the mark is 'wang jin lian ji' which has no meaning. Accommodation reservation services; Arranging of temporary accommodation; Arranging of meals; Cafe services; Cafes; Cafeteria services; Canteen services; Catering services; Cooking services; Food and drink catering; Food cooking services; Food preparation; Mobile catering services; Preparation of food and drink; Preparation of meals; Provision of restaurant booking or reservations from customer loyalty and frequent buyer schemes; Restaurant reservation services; Restaurant services; Restaurants; Salad bar restaurant services; Self-service restaurants; Snack bars (provision of food and drink); Takeaway food and KIM LIAN KEE RESTAURANT SDN. BHD. ; No. 27, Jalan Budiman, Budiman Business Park, 43000 Kajang, Selangor, MALAYSIA Office Ekocheras Office Suites, 693, Jalan Cheras, Batu 5, 56000 Cheras, Kuala Lumpur",,"Tee Lin Yik, Tee IP Sdn Bhd,  A-23-01, Penthouse Office Ekocheras Office Suites, 693, Jalan Cheras, Batu 5, 56000 Cheras, Kuala Lumpur"
,TM2020029828,10 December 2020,,,"The trade mark is limited to the colours as shown in the representation on the form of application. exclusive use of the word ‘micronutrients’. Fertilizers; Calcium cyanamide [fertilizer]; Fertilizing preparations; Fish meal fertilizers; Seaweeds [fertilizers]. WASTECH MULTIGREEN SDN. BHD. ; No. 18, Jalan Anggerik Vanilla Z31/Z, Kota Kemuning, 40460 Shah Alam, Selangor, MALAYSIA 3, Block I, Setiawalk, Persiaran Wawasan Pusat Bandar Puchong, 47160 Puchong, Selangor",,"Chung Chee Yien, NBS Intellectual Sdn. Bhd. I-3- 3, Block I, Setiawalk, Persiaran Wawasan Pusat Bandar Puchong, 47160 Puchong, Selangor"
1,TM2022016770,5 July 2022,,,"Disclaimer: ""agritech"" Agricultural chemicals; Chemical fertilisers; Compound fertilisers; Fertilisers; Liquid fertilisers; Soil conditioners for agricultural purposes; Synthetic fertilizers for agricultural purposes. FAS AGRITECH (M) SDN. BHD. ; Unit 2-1, Level 2, The Podium, Tower 3, Uoa Business Park, No.1, Jalan Pengaturcara U1/51a, Seksyen U1, 40150 Shah Alam, Selangor, MALAYSIA Block C, Jalan Dataran SD 1 Dataran SD PJU 9, Bandar Sri Damansara, 52200 Kuala Lumpur Albumin [animal or vegetable, raw material]; Animal albumen of animal feed; Enzymes to assist in digestion for use in the manufacture of animal feeds; Fertilisers [animal manure]; Fertilisers for agricultural use; Chemicals for use in agriculture; Chemicals for use in agriculture, horticulture and forestry. UNIVERSITI PUTRA MALAYSIA; Putra Science Park, Universiti Putra Malaysia, 43400 UPM, Serdang, Selangor, MALAYSIA Bhd., L26-07, PJX-HM Shah Tower, No.16A Persiaran Barat, 46050 Petaling Jaya, Selangor",,"Yip Jiun Hann, TRADEMARK2U Sdn Bhd No. 1, Block C, Jalan Dataran SD 1 Dataran SD PJU 9, Bandar Sri Damansara, 52200 Kuala Lumpur"
1,TM2022026477,7 October 2022,,,"Chemicals for use in agriculture; Substrates for soil-free growing [agriculture]; Biofertilizers; Chemical fertilizers; Fertilizer [manure]; Fertilizers; Fertilizers for agricultural use; Fertilizers for lands; Fertilizers for plants; Fertilizers for soil and potting soil; Grass fertilizers; Liquid fertilizers; Mixed fertilizers; Natural fertilizers; Chemicals for use in agriculture, except fungicides, herbicides, insecticides and parasiticides. On-line retail store services featuring chemicals for use in agriculture; On-line wholesale store services featuring chemicals for use in agriculture; Retail services for chemicals for use in agriculture; Wholesale services for chemicals for use in agriculture; The bringing together, for the benefit of others, of a variety of goods, excluding the transport thereof, enabling customers to conveniently view and purchase those goods; Online retail store services featuring agricultural equipment; Online wholesale store services featuring agricultural equipment; Retail services for agricultural equipment; Wholesale services for agricultural equipment. Aerial and surface spreading of fertilizers and other agricultural chemicals; Agricultural advice; Agricultural consultancy; Agricultural services; Leasing of agricultural equipment; Professional consultancy in the field of fertilizers and other agricultural preparations; Providing information relating to the aerial and surface spreading of fertilizers and other agricultural chemicals; Rental of agricultural equipment; Spraying of crop protection products for agricultural purposes; Spreading of fertilizers and other agricultural chemicals. GOLDEN AGROCHEM SDN. BHD. ; FL 24(A), Batu 9, Bintulu/Miri Road, Bintulu 97000 Sarawak, MALAYSIA Jalan Liku, Off Jalan Riong, Bangsar, 59100 Kuala Lumpur",,"Geetha Kandiah, KASS International Sdn. Bhd. Suite 8-13A-2, Menara Mutiara Bangsar, Jalan Liku, Off Jalan Riong, Bangsar, 59100 Kuala Lumpur"
,TM2025009587,27 March 2025,,,"exclusive use of the chinese character meaning brand. Adhesives for floor, ceiling and wall tiles; Adhesives for laying ceramic tiles; Adhesives for the construction industry; Cement-waterproofing chemicals, except paints; Cements for affixing tiles; Cements for laying tiles; Rubber based cements [adhesives] for industrial purposes. ION & ECO GREEN PRODUCT SDN. BHD. ; 47, Jalan Nb2 2/2, Taman Nusa Bestari 2, 81300 Johor Bahru, Johor, MALAYSIA Block I, Persiaran Wawasan, Pusat Bandar Puchong, 47160 Puchong, Selangor",,"Thay Pee Ywai, NBS Intelectual Sdn. Bhd., I-3-3, Block I, Persiaran Wawasan, Pusat Bandar Puchong, 47160"
1,TM2025010332,3 April 2025,,,"Preparations of microorganisms, other than for medical and veterinary use; Cultures of microorganisms, other than for medical and veterinary use; Bacterial preparations, other than for medical and veterinary use; Bacterial cultures for addition to food products; Lactobacillus for use in the manufacture of food; Plant extracts, other than essential oils, for the food industry; Proteins for the food industry; Proteins for use in the manufacture of food supplements; Vitamins for use in the manufacture of food supplements; Bacterial preparations for the food industry; Enzyme preparations for the food industry; Milk ferments for the food industry; Bacteria for use in food manufacture. Cultures of microorganisms for medical or veterinary use; Bouillons for bacteriological cultures for medical purposes or veterinary purposes; Dietetic substances adapted for medical use; Food for babies; Powdered milk for babies; Vitamin preparations; Veterinary preparations; Nutritional supplements; Dietary food supplements; Dietary food supplements used to enhance the production of probiotic bacteria in living beings; Probiotic preparations for medical use; Preparations of microorganisms for medical or veterinary use; Mineral dietary supplements; Nutritive substances for microorganisms; Preparations of trace elements for human and animal use; Bacteria and preparations of bacteria as well as biological and biochemical preparations for the treatment of intestinal disturbances and for the prevention and treatment of food allergies and enhancement of the immune system for medical use and healthcare; Cultures of microorganisms for use in dietary supplements. SHENZHEN MEILI NUTRITION TECHNOLOGY CO., LTD. ; 1010, Bldg8, Qianhai Excellence Fin Ctr, 5033 Menghai Avenue, Nanshan Street, Shenzhen, Guangdong, CHINA Kerinchi, Bangsar South, 59200 Kuala Lumpur",Dietetic foods adapted for medical purposes; Dietetic beverages adapted for medical purposes;,"Phoon Chiy Hin , c/o CH Phoon & Associates, A-3-10, Vertical Business Suites, No. 8, Jalan Kerinchi, Bangsar South, 59200 Kuala Lumpur"
1,TM2025010330,3 April 2025,,,"Preparations of microorganisms, other than for medical and veterinary use; Cultures of microorganisms, other than for medical and veterinary use; Bacterial preparations, other than for medical and veterinary use; Bacterial cultures for addition to food products; Lactobacillus for use in the manufacture of food; Plant extracts, other than essential oils, for the food industry; Proteins for the food industry; Proteins for use in the manufacture of food supplements; Vitamins for use in the manufacture of food supplements; Bacterial preparations for the food industry; Enzyme preparations for the food industry; Milk ferments for the food industry; Bacteria for use in food manufacture. Dietetic foods adapted for medical purposes; Dietetic beverages adapted for medical purposes; Cultures of microorganisms for medical or veterinary use; Bouillons for bacteriological cultures for medical purposes or veterinary purposes; Dietetic substances adapted for medical use; Food for babies; Powdered milk for babies; Vitamin preparations; Veterinary preparations; Nutritional supplements; Dietary food supplements; Dietary food supplements used to enhance the production of probiotic bacteria in living beings; Probiotic preparations for medical use; Preparations of microorganisms for medical or veterinary use; Mineral dietary supplements; Nutritive substances for microorganisms; Preparations of trace elements for human and animal use; Bacteria and preparations of bacteria as well as biological and biochemical preparations for the treatment of intestinal",,
1,TM2025010333,3 April 2025,,,"Preparations of microorganisms, other than for medical and veterinary use; Cultures of microorganisms, other than for medical and veterinary use; Bacterial preparations, other than for medical and veterinary use; Bacterial cultures for addition to food products; Lactobacillus for use in the manufacture of food; Plant extracts, other than essential oils, for the food industry; Proteins for the food industry; Proteins for use in the manufacture of food supplements; Vitamins for use in the manufacture of food supplements; Bacterial preparations for the food industry; Enzyme preparations for the food industry; Milk ferments for the food industry; Bacteria for use in food manufacture. Dietetic foods adapted for medical purposes; Dietetic beverages adapted for medical purposes; Cultures of microorganisms for medical or veterinary use; Bouillons for bacteriological cultures for medical purposes or veterinary purposes; Dietetic substances adapted for medical use; Food for babies; Powdered milk for babies; Vitamin preparations; Veterinary preparations; Nutritional supplements; Dietary food supplements; Dietary food supplements used to enhance the production of probiotic bacteria in living beings; Probiotic preparations for medical use; Preparations of microorganisms for medical or veterinary use; Mineral dietary supplements; Nutritive substances for microorganisms; Preparations of trace elements for human and animal use; Bacteria and preparations of bacteria as well as biological and biochemical preparations for the treatment of intestinal disturbances and for the prevention and treatment of food allergies and enhancement of the immune system for medical use and healthcare; Cultures of microorganisms for use in dietary supplements. 1010, Bldg8, Qianhai Excellence Fin Ctr, 5033 Menghai Avenue, Nanshan Street, Shenzhen, Guangdong, CHINA 10, Vertical Business Suites, No. 8, Jalan Kerinchi, Bangsar South, 59200 Kuala Lumpur","SHENZHEN MEILI NUTRITION TECHNOLOGY CO., LTD. ;","Phoon Chiy Hin , c/o CH Phoon & Associates, A-3- 10, Vertical Business Suites, No. 8, Jalan Kerinchi, Bangsar South, 59200 Kuala Lumpur"
,TM2025012263,18 April 2025,,,"Carbohydrates used as an ingredient in the manufacture of nutraceuticals; Enzymes for use in the manufacture of nutraceuticals; Chemical additives for use in the manufacture of pharmaceuticals; Yeast nutrients for industrial purposes; Chemical additives for use in the preparation of animal foodstuffs; Vitamins for the food industry; Proteins for the food industry; Amino acids for industrial purposes; Glucose for the food industry; Enzymes for the food industry; Artificial sweeteners [chemical preparations]; Chemical additives for food; Flour for industrial purposes; Bacterial preparations for the food industry; Probiotic bacteria for the food industry; Probiotic bacterial cultures for the food industry. CJ CHEILJEDANG CORPORATION ; CJ Cheiljedang Center, 330, Dongho-ro, Jung-gu, Seoul, REPUBLIC OF KOREA IPeople House, 7A Clove Hall Road, 10050 Georgetown, Pulau Pinang",,"Loh Yen Pheng, Intellect Worldwide Sdn Bhd, IPeople House, 7A Clove Hall Road, 10050 Georgetown,"
,TM2025012261,18 April 2025,,,"Carbohydrates used as an ingredient in the manufacture of nutraceuticals; Enzymes for use in the manufacture of nutraceuticals; Chemical additives for use in the manufacture of pharmaceuticals; Yeast nutrients for industrial purposes; Chemical additives for use in the preparation of animal foodstuffs; Vitamins for the food industry; Proteins for the food industry; Amino acids for industrial purposes; Glucose for the food industry; Enzymes for the food industry; Artificial sweeteners [chemical preparations]; Chemical additives for food; Flour for industrial purposes; Bacterial preparations for the food industry; Probiotic bacteria for the food industry; Probiotic bacterial cultures for the food industry. CJ CHEILJEDANG CORPORATION ; CJ Cheiljedang Center, 330, Dongho-ro, Jung-gu, Seoul, REPUBLIC OF KOREA IPeople House, 7A Clove Hall Road, 10050 Georgetown, Pulau Pinang",,"Loh Yen Pheng, Intellect Worldwide Sdn Bhd, IPeople House, 7A Clove Hall Road, 10050 Georgetown,"
,TM2020003457,21 February 2020,,,"The trade mark is limited to the colours as shown in the representation on the form of application. Shampoos; Gels, sprays, mousses and balms for hair styling and hair care; Perfumery; Essential oils. KHOH SAW YOONG ; No 33, Jalan SS26/9, Taman Mayang Jaya, 47301 Petaling Jaya, Selangor, MALAYSIA",,
,TM2021007620,17 March 2021,,,"Sun protection preparations. KENVUE INC. ; 1 Kenvue Way, Summit, 07901 New Jersey, UNITED STATES OF AMERICA 1, Leboh Ampang, 50100 Kuala Lumpur ULTRA EM",,"Toh Yoong San Janet, Shearn Delamore & Co. 7th Floor, Wisma Hamzah-Kwong Hing No. 1, Leboh Ampang, 50100 Kuala Lumpur"
,TM2023011889,27 April 2023,,,"Cosmetic slimming preparations; bath and shower preparations; body and beauty care preparations; cosmetic creams for firming the skin; cosmetic creams and lotions for face and body care; cosmetic preparations for slimming purposes; creams for cellulite reduction; lotions, creams and preparations for care of the face, body, scalp, nails and hair; cosmetic creams for toning the skin; lotions for cosmetic purposes; cosmetic preparations for skin care and skin treatment; cleaning preparations for use on the body; non- medicated creams for hydrating the skin; non-medicated creams for moisturising the skin; non-medicated creams for protection of the skin; non-medicated creams for soothing the skin. SLIM DOC SDN. BHD. ; 3A, Jalan Lazat 1, Taman Bukit Indah, 58200 Kuala Lumpur, MALAYSIA Block A-3-5 Plaza Arkadia, No. 3, Jalan Intisari Perdana, Desa Parkcity, 52200 Kuala Lumpur",,"Chua Por Yean, Ian Intellectual Property Sdn. Bhd., Block A-3-5 Plaza Arkadia, No. 3, Jalan Intisari Perdana, Desa Parkcity, 52200 Kuala Lumpur"
,TM2023012688,8 May 2023,,,"Beauty serums; Facial serums; Serums for cosmetic purposes; Cosmetic creams; Cosmetic creams and lotions; Cosmetic gels; Cosmetics; Skin care cosmetics; Skincare cosmetics. NORSYAFINI BINTI KHASIM TRADING AS AI SEYGAK EMPIRE ; No 29 Batu 12, Bukit Besar, Kota Sarang Semut, 06800 Alor Setar, Kedah, MALAYSIA 2, Jalan Dataran Jade 2/2, Dataran Jade 2, Jade Hills, 43000 Kajang, Selangor",,"Mohd. Faizal Bin Ismail, Teraju IP Sdn. Bhd., No 7- 2, Jalan Dataran Jade 2/2, Dataran Jade 2, Jade Hills, 43000"
,TM2025004936,19 February 2025,,,"Cosmetics; Perfumes; Colognes; Skin care preparations and substances[cosmetics]; Skin lotions; Non-medicated skin astringents for cosmetic purposes; Facial concentrated emulsion; After shave lotions; Skin conditioners; Skin cleansing creams; Skin moisturizing creams; Tissues impregnated with cleansing preparation; Make-up preparations; Make-up foundation in the form of powder; Concealers; Toilet water; Beauty masks; Sunblock skin creams; Body care preparations and substances; Toilet soaps; Bath soaps; Body cleansers; Body mist; Body gel; Bath gel; Body cream scrub; Hair care preparations and substances; Hair shampoo; Hair rinses; Hair spray; Hair mousse; Hair gel; Hair dyes; Hair conditioner; Hair treatment; Hair serum; Nail care preparations and substances; Blusher; Lipsticks; Lip glosses; Lip balms; Mascara; Eye shadows; Eyebrow pencils; Eye liners; Toothpastes; Dentifrices; Fabric softeners for laundry use; Laundry preparations; Air fragrancing preparations; Cleaning preparations for household purposes. LG H&H CO., LTD. ; 58, Saemunan-ro, Jongno-gu, Seoul, REPUBLIC OF KOREA Leboh Ampang, 50100 Kuala Lumpur",,"Jyeshta Mahendran, Shearn Delamore & Co. 7th Floor, Wisma Hamzah-Kwong Hing No. 1, Leboh Ampang, 50100 Kuala Lumpur"
,TM2025007421,11 March 2025,,,"Body and beauty care preparations for cosmetic purposes; Eau de parfum; Eau de toilette; Essential oils; Room perfume sprays; Scented linen sprays; Body and beauty care preparations for cosmetic use; Non-medicated cosmetics and toiletry preparations; Aromatic essential oils; Bath and shower preparations; Colognes, perfumes and cosmetics; Non-medicated soaps; Aromatics [essential oils]; Cosmetic preparations for baths; Cosmetic kits comprising primarily mascara, lipsticks, eyebrow Cosmetics; Cosmetics and make-up; Cosmetics and personal care preparations; Skincare cosmetic preparations; Skincare cosmetic products; Skincare preparations [cosmetics]; Skin care preparations; Skin care products; Beauty care cosmetics; Beauty care preparations; Dental care preparations; Deodorants for body care; Facial care preparations; Hair care preparations and products; Mouth care preparations, non-medicated; Nail care preparations and products; Oral care preparations, non- medicated; Sun care preparations; Feminine deodorant sprays; Feminine hygiene cleansing towelettes. METAHEALTH BIOTECH GROUP SDN. BHD. ; A--05--09, Residensi Sunway Geo Lake, Persiaran Tasik Timur Sunway South Quay, Bandar Sunway, 47500 Subang Jaya, Selangor, MALAYSIA","pencils, make-up, foundation and lip glosses; Cosmetic preparations; Cosmetic products for skincare;","YONG BO YEE, BO1-A-9-05, Menara 2, KL Eco City, 3, Jln Bangsar, 59200 Kuala Lumpur"
,TM2025009182,25 March 2025,,,"Toiletry preparations; Facial cleansing milk; Cosmetics; Cosmetic preparations for skin care; Preparations for cleaning teeth; Make-up setting sprays; Foundation; Make-up powder; Face powder; Sunscreen creams; Sunscreen; Rouge; Facial concealer; Make up remover; Oils for toilet purposes; Make-up base; Cosmetic pencils; Anti-perspirants. Room 908, Building 5, No. 188 Lianchuang Street, Wuchang Street, Yuhang District, Hangzhou City, Zhejiang Province, CHINA Bhd., Unit 23.3, 23rd Floor, Surian Tower, No 1, Jalan PJU 7/3, Mutiara Damansara, 47810 Petaling Jaya, Selangor","HANGZHOU XINCHI TECHNOLOGY GROUP CO., LTD. ;","Quality Oracle Sdn. Bhd., c/o Quality Oracle Sdn. Bhd., Unit 23.3, 23rd Floor, Surian Tower, No 1, Jalan PJU 7/3, Mutiara Damansara, 47810 Petaling Jaya, Selangor"
,TM2025009186,25 March 2025,,,"No colour claims Non-medicated toothpastes. GODAKANDA HERBALS (PVT) LIMITED ; No. 102, Kandy Road, Wewaldeniya, SRI LANKA Level 26, Menara Hong Leong, No. 6, Jalan Damanlela, Bukit Damansara, 50490 Kuala Lumpur",,"Yvonne Ong Toon Mein, c/o Raja, Darryl & Loh, Level 26, Menara Hong Leong, No. 6, Jalan Damanlela, Bukit Damansara, 50490 Kuala Lumpur"
,TM2025009187,25 March 2025,,,"Dentifrice; Non-medicated mouth washes; Tooth powders; Dental bleaching gels; Teeth whitening preparations; Tooth cleaning preparations; Cosmetic preparations for the care of mouth and teeth; Tooth whitening pastes; Breath freshening sprays; Breath freshening strips. TOPPII INTERNATIONAL TRADE CO., LIMITED ; Unit D3, 11/F, Luk Hop Industrial Building, No.8 Luk Hop Street, San Po Kong, Kowloon, HK, 999077, CHINA Taman Pandan Indah, 55100 Kuala Lumpur",,"Liew Wai Kit, 27B, Jalan Pandan Indah 4/15, Taman Pandan Indah, 55100 Kuala Lumpur"
,TM2025009188,25 March 2025,,,"Hair and body shampoos; Hair conditioners; Body cream; Cosmetics; Make-up removing milks; Eye make-up removers; Depilatory creams; Skin creams; Facial creams; Facial cleansing milk; Facial masks; Fragrances; Deodorants and antiperspirants; Body lotion; Lipsticks. TOPPII INTERNATIONAL TRADE CO., LIMITED ; Unit D3, 11/F, Luk Hop Industrial Building, No.8 Luk Hop Street, San Po Kong, Kowloon, HK, 999077, CHINA Taman Pandan Indah, 55100 Kuala Lumpur",,"Liew Wai Kit, 27B, Jalan Pandan Indah 4/15, Taman Pandan Indah, 55100 Kuala Lumpur"
3,TM2025010359,3 April 2025,,,"Face cleansers; Hair and body wash; Body mists being non- medicated skin care preparations; Non-medicated skin care preparations; Anti-aging cosmetic preparations; Skin whitening preparations; Intensive hydrating oils; Non- medicated creams for hydrating the skin; Moisturizing creams, lotions and gels; Facial serums; Face and body lotions for cosmetic purposes; Essential oils for cosmetic purposes; Non-medicated skin toners; Skin toners for cosmetic use; Exfoliating scrubs for cosmetic purposes. Protein powder dietary supplements; Herbal dietary supplements; Nutritional supplements; Slimming tea for medical purposes; Herbal beverages for medicinal purposes. LEAFEORA SDN BHD; No. 9, Jalan Pusat Perdagangan Tropika 1, Pusat Perdagangan Tropika, 71700 Mantin, Negeri Sembilan, MALAYSIA KomarMax",,
