3,TM2024037441,8 August 2024,"21 February 2024, Switzerland",,"International Registration Number : 1824795 Soaps, air fragrancing preparations, perfumes and toilet water, essential oils; Shoe polish, polish for leather. Candles; Industrial oils and greases; Lubricants. Cutlery, forks and spoons; Multi-function knives; Manicure sets. Spectacles, spectacle cases, cords for spectacles, goggles for sports; Binoculars; Audio headsets, earpieces for remote communication, cameras [photography]; Diving suits, diving gloves and masks, ear plugs for divers, nose clips for divers and swimmers; Helmets for cyclists; Smart watches; Batteries. Table lamps, lamps for lighting. Horological instruments, namely, watches, wristwatches, component parts of timepieces and chronometers, chronographs (horological instruments), watch bands, dials (horological instruments), watch movements and parts thereof, boxes and presentation cases for horological instruments and jewelry; Jewelry, jewelry (""joaillerie""); Precious stones and semi-precious stones; Precious metals and alloys thereof; Pins (jewelry); Cuff links; Key rings. Stationery, office requisites except furniture, writing instruments, calendars, gift wrap, terrestrial globes. traveling bags, trunks, valises, suitcases, rucksacks; Handbags, beach bags, sports bags, tote bags; Toiletry bags (empty), traveling sets (leatherware), card cases (wallets), document cases, business card holders, wallets, coin purses; Briefcases (leather goods); Leather pouches; Leather cases; Umbrellas and parasols; Walking sticks; Saddlery articles; Collars, leashes and clothing for animals. Mirrors, hand-held mirrors (toilet mirrors), exhibition stands (display stands), display stands for watches, frames; Mother-of-pearl, unworked or semi-worked; Shells, meerschaum. Decanters; Art objects made of porcelain, ceramic, earthenware, terracotta or glass; Tableware; Glassware, porcelain and earthenware, drinking bottles, mugs, coin banks; Vases; Combs; Brushes.",,
3,TM2024036647,8 August 2024,"8 August 2024, Japan",,"International Registration Number : 1824127 Disclaimer: The word ""whitening"" Teeth whitening preparations; Tooth whitening pastes; Tooth whitening creams; Dental bleaching gels; Tooth cleaning preparations; Teeth cleaning lotions; Non-medicated mouthwashes; Non-medicated dental rinse; Tooth polishes; Dentifrices; Toothpastes. Dental teeth whitening apparatus with LED light; Dental apparatus and instruments for use in the field of cosmetic dentistry services; Dental apparatus and instruments; Dental apparatus, electric; Dentists' chairs. CHARION CO., LTD. ; 11-9 Azabudai 1-chome, Minato-ku Tokyo 106-0041, JAPAN",,
,TM2024034195,12 September 2024,,,"International Registration Number : 1819716 Anti-aging cosmetic preparations; Cosmetic preparations for the hair and scalp; Moisturizing creams, lotions and gels; Cosmetic preparations for baths; Body essence; Non- medicated preparations for the care of skin, hair and scalp; Non-medicated toiletry preparations; Cosmetic preparations for skin renewal; Mask pack for cosmetic purposes; Make-up removing preparations; Cosmetics; Eye cream; Facial packs; Shampoos; Body creams; Toners for cosmetic purposes; Exfoliant cosmetics. VT CO., LTD. ; 139, Saneopdanji-gil, Paju-si Gyeonggi-do, REPUBLIC OF KOREA",,
3,TM2024036658,12 September 2024,,,"International Registration Number : 1824238 Non-medicated mouthwashes for pets; Baby wipes impregnated with cleaning preparations; Tissues impregnated with a skin cleanser; Shampoos for pets [non-medicated grooming preparations]; Deodorants for pets; Impregnated paper tissues for cleaning dishware; Spectacle wipes impregnated with a detergent; Pre-impregnated cleansing tissues; Non-medicated paw balms for pets; Non- medicated pet shampoos. Sanitary pants for pets; Vitamins for pets; Diapers for pets; Medicated shampoos for pets; Dietary supplements for pets; Deodorizing preparations for pet litter boxes; Disposable house training pads for pets; Disinfecting wipes; Disposable diapers for pets; Disposable absorbent pads for lining pet crates. Food waste bags of biodegradable plastic for household use; Plastic bags for pet waste disposal; Paper shopping bags; Paper; Cardboard packaging; Bottle wrappers of paper or cardboard; Shopping bags of paper or plastic. SHANDONG AISHULE SANITARY PRODUCTS CO., LTD.; Northwest Corner Of The Intersection Of Qiyang Road And Industrial Third Road, Linyi High-tech Zone 277727 Shandong Province, CHINA",,
3,TM2024036648,20 September 2024,,,"International Registration Number : 1824129 Cosmetics; Body and beauty care cosmetics; Facial packs; Hair care preparations; Perfume; Nail polish; Shampoos; Hand cleansers; Cosmetic soaps; Air fragrancing preparations. Pharmaceutical drugs; Medicines for human purposes; Pharmacological preparations for skin care; Pharmaceutical preparations for treating skin disorders; Dermatological pharmaceutical products; Medicated preparations for skin treatment; Pharmaceutical preparation for skin care. BRANDNEWLAB CO., LTD. ; 3F, 52 Seolleung-ro 162-gil, Gangnam-gu, Seoul, REPUBLIC OF KOREA",,
,TM2024038287,25 September 2024,"25 March 2024, Republic",,"International Registration Number : 1825696 of Korea Sun block [cosmetics]; Facial serums for cosmetic purposes; Cosmetic preparations for skin care; Badian essence; Anti- wrinkle cream for cosmetic purposes; Gels for cosmetic purposes; Cosmetic creams; Cosmetic preparations. SELIOS INC. ; 115, 8F, 39, Seocho-daero 77-gil, Seocho-gu Seoul, REPUBLIC OF KOREA",,
,TM2024037433,27 September 2024,"24 September 2024,",,"International Registration Number : 1824707 Japan Soaps; Laundry detergents; Toilet cleaners; Cosmetics; Dentifrice; Non-medicated mouthwashes; Body washes; Shampoos; Hair care preparations; Hand cleansers; Skin care products; Detergents for household use; Fabric softeners; Perfumery; Essential oils; Air fragrancing preparations; Deodorants for human beings; Bleaching preparations; Cleaning preparations; Polishing preparations. OUJI SEKKEN CORPORATION ; 600 Higashichisato, Kawage-Cho, Tsu-City Mie Prefecture 510-0303, JAPAN",,
,TM2024037429,1 October 2024,"1 October 2024, France",,"International Registration Number : 1824606 Perfumes; Perfumery products; Eaux de toilette; Eau de Cologne; Deodorants [perfumery]. LOUIS VUITTON MALLETIER ; 2 rue du Pont-Neuf F-75001 Paris, FRANCE",,
,TM2024036644,3 October 2024,"1 October 2024,",,"International Registration Number : 1824067 European Union Intellectual Property Office (EUIPO) Cosmetics; Cosmetic moisturizers; Cosmetic oils; Tonics [cosmetics]; Cosmetic soaps; Cosmetics and cosmetic products; Natural cosmetics; Organic cosmetics; Functional cosmetics; Skin masks [cosmetics]; Facial cosmetic powders; Tanning gels [cosmetics]; Cosmetic preparations for eyelashes; Non-medicinal cosmetics; Cosmetic powders; Cosmetics for eyelashes; Hair preparations and treatments. SEPAI BEAUTICEUTICAL DIVISION, S.L. ; Ronda de Cant Fatjó, número 8, Planta 1, Local SEPAI E-08290 CERDANYOLA DEL VALLÉS, SPAIN PHOROS",,
3,TM2024038321,18 October 2024,,,"International Registration Number : 1826037 Soap products; Dentifrices; Cosmetics; Perfumery; Fragrances. Beauty salon services; Barbers' services. SUVI INC. ; 9-12 Hondori, Naka-ku, Hiroshima-shi Hiroshima 730-0035, JAPAN ARMING",,
,TM2024038311,22 October 2024,,,"International Registration Number : 1825969 Cosmetics for the care of scalp; Hair cleaning preparations; Hair oils; Body cleaning preparations; Shampoos; Shampoos for the prevention of hair loss; Hair essences [cosmetics]; Hair treatment preparations [cosmetics]; Cosmetics. ENVECO COSMETIC CO., LTD; 35, Hwangeum-ro 323beon-gil, Yangchon-eup, Gimpo-si Gyeonggi-do 10049, REPUBLIC OF KOREA",,
,TM2024037504,25 October 2024,"26 April 2024, United",,"International Registration Number : 1825472 States Of America Perfume; Eau de parfum; Eau de toilette; Eau de cologne; Body mist; Body lotion; Shower gel; Shower scrub; Fragranced body care preparations, namely, body lotions, bath gels, shower gels, body scrubs, and body souffles; Non- medicated skincare preparations, namely, body mousse and body mist; Fragranced hair mist; Perfume oil. GRANDARI, INC. ; 1880 Century Park East, Suite 1600 Los Angeles CA 90067, UNITED STATES OF AMERICA",,
,TM2024036675,30 October 2024,,,"International Registration Number : 1813851 Cosmetics; Make-up; Air fragrancing preparations; Oils for perfumes and scents; Toiletry preparations. FUGENBIO CO., LTD. ; A-dong 424-ho(Sanghyeon-dong, Gwanggyo Woominewv Knowledge Industry Center), 338, Gwanggyojungang-ro, Suji-gu, Yongin-si Gyeonggi-do 16942, REPUBLIC OF KOREA HOLLISTER DAY DATE",,
,TM2024036677,31 October 2024,,,"International Registration Number : 1816354 After-shave preparations; Shaving products; Bath oils; Body mist; Body washes; Hair conditioners; Shower gels; Hair care preparations; Nail polish; Shampoos; Soaps for personal use; Suntan lotions; Lip balms; Lip glosses; Body sprays used as deodorants and perfumes; Deodorants for body care; Deodorants for personal use; Antiperspirants; Beauty creams; Beauty creams for body care; Beauty lotions; Cosmetic products for body and beauty care; Eau de Cologne; Perfumes for personal use; Perfumes; Air fragrancing preparations. ABERCROMBIE & FITCH EUROPE SAGL ; Via Morée CH- 6850 Mendrisio, SWITZERLAND",,
,TM2024036678,31 October 2024,,,"International Registration Number : 1816355 After-shave preparations; Shaving products; Bath oils; Body mist; Body washes; Hair conditioners; Shower gels; Hair care preparations; Nail polish; Shampoos; Soaps for personal use; Suntan lotions; Lip balms; Lip glosses; Body sprays used as deodorants and perfumes; Deodorants for body care; Deodorants for personal use; Antiperspirants; Beauty creams; Beauty creams for body care; Beauty lotions; Cosmetic products for body and beauty care; Eau de Cologne; Perfumes for personal use; Perfumes; Air fragrancing preparations. ABERCROMBIE & FITCH EUROPE SAGL ; Via Morée CH- 6850 Mendrisio, SWITZERLAND LIQUA-PLAY",,
,TM2024038306,8 November 2024,"10 May 2024, United",,"International Registration Number : 1825884 States Of America Eye shadow. STILA STYLES, LLC ; 801 North Brand Boulevard, Suite No. 500 Glendale CA 91203, UNITED STATES OF AMERICA SSEDAM",,
,TM2024039188,14 November 2024,,,"International Registration Number : 1827501 Cosmetics. HAN, CHUL JONG ; 1204-1601, 39 Dongbaekpyeongchon- ro, Giheung-gu, Yongin-si Gyeonggi-do, REPUBLIC OF KOREA Dr.Melaxin",,
,TM2024039174,18 November 2024,"2 September 2024,",,"International Registration Number : 1827297 Republic of Korea Polishing preparations; Breath freshening sprays; Functional cosmetics being skin care preparations; Cosmetic preparations for the hair and scalp; Body essence; Non- medicated mouthwashes and gargles; Sun block [cosmetics]; Toiletry preparations; Laundry preparations; Cosmetic preparations for skin care; Skin cleansers; Essential oils for cosmetic purposes; Adhesives for affixing artificial nails or eyelashes; Foam cleansers for personal use; Toothpaste; Cosmetic preparations for skin renewal; Perfume; Hair gel and hair mousse; Mask pack for cosmetic purposes; Cosmetics. BRAND501 CORP. ; B-dong, 20, Achasan-ro 9-gil, Seongdong-gu Seoul, REPUBLIC OF KOREA",,
,TM2020015326,19 May 2020,"12 December 2019,",,"International Registration Number : 1541328 Japan Registration of this trade mark shall give no right to the exclusive use of the word ‘clear’. Pharmaceutical preparations; Antimicrobials for dermatologic use; Fumigants, other than for agricultural purposes; Fungicides, other than for agricultural purposes; Insect- repellents, other than for agricultural purposes; Disinfectants for hygiene purposes; Chemico-pharmaceutical preparations; Air deodorizing preparations; Antibacterial soap; Deodorants, other than for human beings or for animals; Adhesive tapes for medical purposes; Gauze for dressings; Dental materials; Diapers; Diaper covers; Fly catching paper; Mothproofing paper; Air purifying preparations; Sterilising preparations; Fungicides; Germicides; Disinfectants; Antiseptics; Mothproofing preparations; Insect repellents; Veterinary preparations; Animal washes [insecticides]; Teeth filling material; Dental wax. SUNSTAR ENGINEERING INC. ; 3-1, Asahi-machi, Takatsuki-shi, Osaka 569-1134, JAPAN Block K, No. 2 Jalan Solaris, Solaris Mont Kiara Kuala Lumpur, 50480 Kuala Lumpur",,"Angie Neoh Hooi Sim, Abasan Sdn Bhd K-03-06, Block K, No. 2 Jalan Solaris, Solaris Mont Kiara Kuala Lumpur,  50480 Kuala Lumpur"
,TM2023023608,28 July 2023,,,"International Registration Number : 1730649 Colours Claimed: Blue, black, green, orange, red, purple and white. exclusive use of the German words meaning ‘Food supplements’, ‘Synbiotic’, ‘9 Various selected bacterial strains’, ‘Growth promoter (FOS)’, ‘10 Portion pouches with enteric- coated granules’ and ‘Only one capsule per day’. Pharmaceutical and veterinary preparations; Sanitary preparations for medical purposes; Dietetic foods and substances adapted for medical or veterinary use; Food for babies; Adhesive plasters; Wound dressings [medical]; Dietary supplements and dietetic preparations. VIVATREX GMBH; Empeler Str. 118 46459 Rees, GERMANY 06 Lingkaran SV, Sunway Velocity, Jalan Peel, 55100 Kuala Lumpur",,"Shee Shu Wen, Henry Goh & Co Sdn Bhd, V02-10- 06 Lingkaran SV, Sunway Velocity, Jalan Peel, 55100 Kuala"
,TM2023023600,28 July 2023,,,"International Registration Number : 1689992 Colours Claimed: Blue, black, green, orange, red, purple and white. exclusive use of the German words meaning ‘Food supplements’, ‘Synbiotic’, ‘9 Various selected bacterial strains’, ‘Growth promoter (FOS)’, ‘10 Portion pouches with enteric- coated granules’ and ‘Only one capsule per day’. Pharmaceutical and veterinary preparations; Sanitary preparations for medical purposes; Dietetic foods and substances adapted for medical or veterinary use; Food for babies; Adhesive plasters; Wound dressings [medical]; Dietary supplements and dietetic preparations. VIVATREX GMBH ; Empeler Str. 118 46459 Rees, GERMANY 06 Lingkaran SV, Sunway Velocity, Jalan Peel, 55100 Kuala Lumpur",,"Shee Shu Wen, Henry Goh & Co Sdn Bhd, V02-10- 06 Lingkaran SV, Sunway Velocity, Jalan Peel, 55100 Kuala"
,TM2024039123,13 June 2024,,,"International Registration Number : 1826833 Medicines for human purposes; Pharmaceutical preparations; Chemico-pharmaceutical preparations; Drugs for medical purposes; Biological preparations for medical purposes; Medical preparations for slimming purposes; Slimming pills; Injectable medicinal solutions; Bulk drugs; Biochemical medicines. SHANGHAI HEP BIOTECHNOLOGY CO., LTD ; Floor 1-2, Building 2, Lane 500, Furonghua Road, Pudong New Area Shanghai, CHINA SHANGHAI HEP PHARMACEUTICAL CO. LTD ; Floor 4, No. 23-24, Lane 100, Banxia Road, Pudong New Area Shanghai, CHINA",,
5,TM2024025420,26 June 2024,,,"International Registration Number : 1805239 Immunostimulants; Pharmaceutical preparations; Chemico-pharmaceutical preparations; Chemical preparations for pharmaceutical purposes; Pharmaceuticals; Cooling sprays for medical purposes; Ferments for pharmaceutical purposes; Plant extracts, other than essential oils, for pharmaceutical purposes; Elixirs [pharmaceutical preparations]; Ethers for pharmaceutical purposes; Esters for pharmaceutical purposes; Cellulose esters for pharmaceutical purposes; Cellulose ethers for pharmaceutical purposes.",,
5,TM2024036687,26 July 2024,"17 April 2024, Switzerland",,"International Registration Number : 1822683 Pharmaceutical preparations; Sanitary products for medicine; Dietetic substances and foodstuffs for medical or veterinary use, food for babies; Dietary supplements for humans and animals; Plasters, material for dressings; Materials for dental fillings and dental impressions. Surgical, medical, dental and veterinary apparatus and instruments; Artificial limbs, eyes and teeth; Orthopedic articles; Suture materials; Therapeutic and assistive Apparatus, devices and articles for the nursing of infants; Sexual activity apparatus, devices and articles. ALPEN PHARMA AG ; Finkenhubelweg 16, CH-3012 Bern, SWITZERLAND IDAFER",apparatus adapted for the disabled; Massage apparatus;,
,TM2024032178,31 July 2024,,,"International Registration Number : 0818661 Pharmaceutical and veterinary preparations; Healthcare preparations. VIFOR (INTERNATIONAL) AG (VIFOR (INTERNATIONAL) LTD.) (VIFOR (INTERNATIONAL) INC.) ; Rechenstrasse 37 CH-9014 St. Gallen, SWITZERLAND Wisma UOA Damansara 50 Jalan Dungun, Damansara Heights Kuala Lumpur, 50490 Kuala Lumpur",,"Teh Hong Koon, Skrine Unit No. 50-8-1, 8th. Floor, Wisma UOA Damansara 50 Jalan Dungun, Damansara Heights Kuala Lumpur,  50490 Kuala Lumpur"
5,TM2024027264,5 August 2024,,,"International Registration Number : 1503401 Food for babies. Meat, fish, poultry and game; Meat extracts; Preserved, frozen, dried and cooked fruits and vegetables; Jellies, jams, compotes; Eggs, milk and milk products; Edible oils and fats. The bringing together, for the benefit of others, of a variety of goods, excluding the transport thereof, namely food for babies, dietetic substances adapted for medical use, pharmaceutical and veterinary preparations, preserved, frozen, dried and cooked fruits and vegetables, fruit pulp, jellies, jams, compotes, meat, fish, poultry, meat extracts, eggs, milk and milk products, edible oils and fats, coffee, tea, cocoa, sugar, rice, artificial coffee, flour and preparations made from cereals, bread, pastries, confectionery, ice cream, honey, golden syrup, yeast, salt, mustard, vinegar, sauces [condiments], spices - enabling customers to conveniently view and purchase those goods; On-line retail and wholesale store services featuring food for babies, dietetic substances adapted for medical use, pharmaceutical and veterinary preparations, preserved, frozen, dried and cooked fruits and vegetables, fruit pulp, jellies, jams, compotes, meat, fish, poultry, meat extracts, eggs, milk and milk products, edible oils and fats, coffee, tea, cocoa, sugar, rice, artificial coffee, flour and preparations made from cereals, bread, pastries, confectionery, ice cream, honey, golden syrup, yeast, salt, mustard, vinegar, sauces [condiments], spices; Presentation of goods on mass media for retail purposes; Business merchandising display services; Sales promotion for others; Organization of events, exhibitions, fairs and shows for commercial, promotional and advertising purposes; Advertising, including on-line advertising on a computer network; Business administration; Office functions. FUTURA S.P.A. ; Via Picasso 3 I-48012 BAGNACAVALLO (RA), ITALY Peel, 55100 Kuala Lumpur",,"Shee Shu Wen, Henry Goh & Co Sdn Bhd, V02-10-06 Lingkaran SV, Sunway Velocity, Jalan Peel, 55100 Kuala Lumpur"
5,TM2024039129,30 August 2024,,,"International Registration Number : 1826873 Dietetic substances adapted for medical use; Semen for artificial insemination; Disinfectants for hygiene purposes; Disinfectant wipes; Bouillons for bacteriological cultures for medical purposes or veterinary purposes. Blankets, electric, for medical purposes; Breast pumps; Orthopedic articles; Suture materials; Acupuncture needles; Medical apparatus and instruments; Fumigation apparatus for medical purposes; Surgical implants comprised of artificial materials. XI’AN TIANLONG SCIENCE AND TECHNOLOGY CO., LTD ; Tianlong Science and Technology Industrial Park, No. 4266 Shanglin Road, High speed Railway New City, Xi’an Economic and Technological Development Zone 710000 Shaanxi Province, CHINA FILTRACE",,
,TM2024034198,24 September 2024,"29 March 2024, United",,"International Registration Number : 1819894 States Of America medical imaging, and monitoring of physiological function. MEDIBEACON INC. ; 425 N. New Ballas Rd., Suite 100, St. Louis MO 63141, UNITED STATES OF AMERICA",,
5,TM2024039179,2 October 2024,"18 April 2024, France",,"International Registration Number : 1827382 Pharmaceutical preparations for the treatment of kidney diseases; Food supplements for the treatment of kidney diseases; Concentrates in solid or liquid form for pharmaceutical use for preparing dialysis fluid; Dialysis fluid for hemodialysis; Dialysis fluid for peritoneal dialysis; Pharmaceutical solutions for dialysis. Dialysis apparatus and disposable articles for dialysis apparatus; Home kidney dialysis apparatus and accessories therefor; Machines and apparatus for preparing dialysis solutions. Installation, repair and maintenance of medical equipment, namely, dialysis equipment and equipment used in relation to dialysis equipment.",,
,TM2024037440,2 October 2024,,,"International Registration Number : 1824761 Mark transaltion: No meaning Gauze for medical purposes; Adhesive plasters; Bunion pads; Bandages for dressings; Gauze for dressings; Scapulars for surgical purposes; Surgical bandages; Hygienic bandages; Sticking plasters for medical purposes; Medical bandages; Adhesive bandages for medical purposes; Elastic bandages for medical purposes; Dressings for medical purposes; Surgical dressings; Ointments for pharmaceutical purposes; Medicated lotions and creams for the body, skin, face, and hands; Skin care preparations for medical purposes; Medicated creams; Acne creams [pharmaceutical preparations]; Gels, creams and solutions for dermatological use; Medicated lotions for treating dermatological conditions; Medicated ointments for treating dermatological conditions; Medicated creams for treating dermatological conditions; Pharmaceutical preparations for the prevention of stretch marks; Pharmaceutical lipsalves. WONBIOGEN CO., LTD. ; 56, 1gongdan-ro 5-gil, Gumi-si Gyeongsangbuk-do 39372, REPUBLIC OF KOREA HYDRALIFE",,
,TM2024034882,21 October 2024,,,"International Registration Number : 1764640 Dietary supplements for animals. SOCIéTé DES PRODUITS NESTLé S.A. ; CH-1800 Vevey, SWITZERLAND",,
,TM2024036673,1 November 2024,,,"International Registration Number : 1785492 Pharmaceutical preparations and substances. ALEXION PHARMACEUTICALS, INC.; 121 Seaport Boulevard Boston MA 02210, UNITED STATES OF AMERICA",,
,TM2024036669,1 November 2024,,,"International Registration Number : 1709798 Pharmaceutical preparations for the treatment of hematological, nephrological, autoimmune, immunological, ocular, neurological and inflammatory related diseases and disorders. ALEXION PHARMACEUTICALS, INC.; 121 Seaport Boulevard Boston MA 02210, UNITED STATES OF AMERICA Trecondi",,
,TM2024036663,6 November 2024,,,"International Registration Number : 1428670 Pharmaceutical preparations. MEDAC GESELLSCHAFT FüR KLINISCHE SPEZIALPRäPARATE MBH; Theaterstraße 6, 22880 Wedel, GERMANY CELLERGIZE",,
,TM2024039120,14 November 2024,"31 July 2024, United",,"International Registration Number : 1826804 States Of America Dietary and nutritional supplements; Dietary and nutritional supplements for general health and wellness; Dietary supplements; Dietary supplements for pets in the nature of a powdered drink mix; Dietary supplements for general health and wellness; Dietary supplements in the form of powder; Liquid nutritional supplement; Mineral nutritional supplements; Natural herbal supplements; Nutraceuticals for use as a dietary supplement for general health and wellness; Nutritional supplements; Nutritional supplements in the form of powder; Powdered nutritional supplement drink mix and concentrate; Vitamin and mineral supplements. SOLETLUNA HOLDINGS, INC.; 9775 Businesspark Avenue San Diego CA 92131, UNITED STATES OF AMERICA",,
,TM2024025489,1 July 2024,"19 June 2024, Japan",,"International Registration Number : 1805832 Nonferrous metals and their alloys; Copper and its alloys; Lead and its alloys; Tin and its alloys; Solders; Solder alloys; Silver solder; Gold solder; Lead-free solder; Solder in the form of ball; Solder in the form of rod; Solder in the form of bar; Solder with grease; Soldering wire of metal; Solder in the form of paste; Solder in the form of powder. SENJU METAL INDUSTRY CO., LTD.; 23 Senju-Hashido- Cho, Adachi-Ku, Tokyo 120-8555, JAPAN",,
,TM2024038279,4 July 2024,,,"International Registration Number : 1825624 shi means “real”; ye means “industry”, the four chinese characters as a whole has no meaning. Washers of metal; Bolts of metal; Cotter pins; Cramps of metal [crampons]; Screws of metal; Steel, unwrought or semi- wrought; Eye bolts; Nuts of metal; Posts of metal; Metal nuts. AOZHAN INDUSTRIAL CO., LTD ; Zhenzhong Village, Dangwan Town, Xiaoshan District, Hangzhou City 311221 Zhejiang Province, CHINA MLCMC",,
6,TM2024038309,11 September 2024,"10 July 2024, Japan",,"International Registration Number : 1825941 Composite materials composed of copper and molybdenum; Nonferrous metals and their alloys. Heat radiation components for semiconductor devices made of composite materials composed of copper and molybdenum; Heat spreaders for semiconductor devices made of composite materials composed of copper and molybdenum; Heat radiation components for semiconductor devices; Heat spreaders for semiconductor devices; Voltage regulating apparatus and instruments; Electrical control apparatus and instruments; Power distribution or control machines and apparatus. A.L.M.T. CORP. ; 8-21-1, Ginza, Chuo-ku Tokyo 104-0061, JAPAN",,
