,TM2025012022,17 April 2025,,,"Registration of this trade mark shall give no right to the exclusive use of the words ''vape & florist”. Online retail store services featuring articles for use with tobacco; Online retail store services featuring tobacco; Online wholesale store services featuring articles for use with tobacco; Online wholesale store services featuring tobacco; Retail or wholesale services for tobacco; Retail or wholesale services for tobacco and smokers' articles; Retail services or wholesale services for tobacco and smokers' articles; Retail services provided by tobacco shops; Retail services relating to articles for use with tobacco; Wholesale services in relation to articles for use with tobacco; Wholesale services in relation to tobacco; Bringing together, for the benefit of others, of a variety of goods, excluding the transport thereof, enabling customers to conveniently view and purchase those goods; Advertising and marketing; Advertising and marketing services provided by means of social media; Advertising, marketing and promotional consultancy, advisory and",,
,TM2025012324,18 April 2025,,,"Retail services in relation to educational supplies; Online retail store services featuring educational supplies; Retail services or wholesale services for paper and stationery; Online retail store services featuring stationery supplies; Retail and wholesale services for teaching materials [except apparatus]; Distribution of advertising material [leaflets, prospectuses, printed material, samples]; Advertising, marketing and promotion services; Publication of advertising material on-line; Arranging and conducting of marketing events; Organization of events, exhibitions, fairs and shows for commercial, promotional and advertising purposes. LMS EDUCATION HOLDINGS SDN. BHD. ; 12-3A, 2 Rio Tower, Persiaran Rio Bandar Puteri, 47100 Puchong, Selangor, MALAYSIA KL Gateway, No. 2, Jalan Kerinchi, 59200 Kuala Lumpur",,"Brenda Lee Wen Yi, D-25-03, Menara Suez Cap 1, KL Gateway, No. 2, Jalan Kerinchi, 59200 Kuala Lumpur"
,TM2025012531,21 April 2025,,,"No colour claim Dissemination of advertising and promotional materials; Providing business information in the field of social media; Advertising; Online retail of third-party esim cards for the purchase of telecommunication services; Online retail services for virtual sim cards; Retail services for sim cards. TRAVERR PLT ; Level 3A, Sunway Visio Tower, Lingkaran SV, Sunway Velocity, 55100 Kuala Lumpur, MALAYSIA 1/1A, Taman Subang Mewah, 47620 Subang Jaya, Selangor",,"Flexly Consulting Sdn Bhd, No. 9-2, Jalan USJ 1/1A, Taman Subang Mewah, 47620 Subang Jaya, Selangor"
35,TM2025012464,21 April 2025,,,"Registration of this trade mark shall give no right to the exclusive use of the word ‘print’. Electronic publication of printed matter for advertising purposes; on-line retail store services featuring printed matter; on-line wholesale store services featuring printed matter; promoting the sale of goods and services of others through printed material; publication of printed matter for advertising purposes; retail and wholesale services for printed matter; electronic billboard advertising; publication of printed matter for advertising purposes in electronic form; advertising and marketing; advertising and promotional services; advertising and publicity services; advertising, marketing and promotional consultancy, advisory and assistance services; banner advertising; brand creation services [advertising and promotion]; creation of advertising material; development of advertising concepts in the nature of brochures; development of advertising concepts in the nature of flyers; development of the advertising content of brochures for others; dissemination of advertisements and of advertising material [flyers, brochures, leaflets and samples]; distribution of advertising material; distribution of flyers, brochures, printed matter and samples for advertising purposes. Customized printing of company names and logos for promotional and advertising purposes on the goods of others; design printing for others; digital on-demand printing of books and other documents; digital photo printing services; digital printing services; fine art printing services; inkjet printing services; offset printing; printing; printing and providing information relating thereto; printing of advertising brochures for others; printing of advertising matter; printing of books; printing of calendars; printing of decorative patterns on plastic films and wrapping paper; printing of documents from digital media; printing of images on objects; printing on textiles and fabrics; printing, lithographic printing, screen printing and digital printing. EAN LABEL INDUSTRY SDN. BHD. ; No.18 Jln Ida 1a Taman Perindustrian Desa Aman, Kuala Lumpur 52200 Kuala Lumpur, MALAYSIA",,"Chuang Vi Nie, 4, Jalan Bunga Cempaka 5, Taman Mawar, 56100 Cheras, Kuala Lumpur"
35,TM2025013385,28 April 2025,,,"representation on the form of application. Auctioning of property; Advertising of real estate; Arranging and conducting of real estate auctions; Business administration and management relating to real estate; Real estate marketing; Real estate sales management; Business management and administration; Advertising, promotion and marketing. Accommodation bureau services [apartments]; Apartment and office rentals; Apartment house management; Arranging finance for construction projects; Arranging of leases and rental agreements for real estate; Arranging of mortgages; Capital investment in real estate; Commercial real estate agency services; Management of buildings; Property portfolio management; Real estate agency services; Valuation of real estate; Real estate management; Rental of offices for co- working; Rental of real estate. CENTROHILL DEVELOPMENT SDN. BHD. ; Harbour Trade Centre 2-5-29, Gat Lebuh Macallum, 10300 Georgetown, Pulau Pinang, MALAYSIA B01-A-09, Menara 2, KL Eco City, No 3, Jalan Bangsar, 59200 Kuala Lumpur",,"Teh Voon How, Gordian Consultancy Sdn. Bhd. B01-A-09,  Menara 2, KL Eco City, No 3, Jalan Bangsar, 59200 Kuala Lumpur"
,TM2025013398,28 April 2025,,,"Advertising; Business management of wholesale and retail outlets; Demonstration of goods; Distribution of samples; Goods or services price quotations; Marketing; Online advertising; Online marketing; Presentation of companies and their goods and services on the internet; Presentation of goods on communication media, for retail purposes; Product marketing; Promotional marketing; Providing consumer information relating to goods and services; Providing consumer product information via the internet; Providing consumer product information; Providing marketing information via websites; Provision of commercial information and advice for consumers in the choice of products and services; Provision of information and advice to consumers regarding the selection of products and items to be purchased; Publicity and sales promotion relating to goods and services available on-line; Publicity and sales promotion relating to goods and services; Purchasing of goods and services for other businesses; Social media marketing; Retail and wholesale services in relation to clothing, footwear and headwear. NG SENG BOON TRADING AS SVIBE CLOTHING ENTERPRISE ; 1-23-1, Edge 360 Condominium, Lintang Haji Ahmad, Taman Bukit Dumbar Timur, 11600 Jelutong, Pulau Pinang, MALAYSIA 10, Vertical Business Suites, No. 8, Jalan Kerinchi, Bangsar South, 59200 Kuala Lumpur",,"Phoon Chiy Hin , c/o CH Phoon & Associates, A-3- 10, Vertical Business Suites, No. 8, Jalan Kerinchi, Bangsar South, 59200 Kuala Lumpur"
,TM2025013413,28 April 2025,,,"Registration of this trade mark shall give no right to the exclusive use of the word ‘smart’. On-line retail store services featuring smartphones; on-line wholesale store services featuring smartphones; retail services for smartphones; wholesale services for smartphones; retail and wholesale services for computers and computer peripheral devices; retail and wholesale services for peripherals adapted for use with computers and other smart devices. SMART EDGE INTERNATIONAL SDN. BHD. ; CP 01-28 & CP 01-29, First Floor Menara Mpks, City Plaza Jalan Tunku Ibrahim, 05000 Alor Setar, Kedah, MALAYSIA Mawar, 56100 Cheras, Kuala Lumpur",,"Chuang Vi Nie, 4, Jalan Bunga Cempaka 5, Taman Mawar, 56100 Cheras, Kuala Lumpur"
,TM2025013420,28 April 2025,,,"Presentation of goods on communication media, for retail purposes; Advertising; Online advertising on a computer network; Commercial administration of the licensing of the goods and services of others; Sales promotion for others; Provision of an online marketplace for buyers and sellers of goods and services; Import-export agency services; Personnel management consultancy; Search engine optimization for sales promotion; Accounting; Sponsorship search; Retail services for pharmaceutical, veterinary and sanitary preparations and medical supplies; Business management consultancy. WUHAN MEILILIAN HOLDINGS CO., LTD ; Zone F, 1st Floor, Building 1, No. 8 Fengshu New Road, Wuhan Economic and Technological Development Zone, Wuhan City, Hubei Province, CHINA Bhd., Unit 23.3, 23rd Floor, Surian Tower, No 1, Jalan PJU 7/3, Mutiara Damansara, 47810 Petaling Jaya, Selangor BONDMAT",,"Quality Oracle Sdn. Bhd., c/o Quality Oracle Sdn. Bhd., Unit 23.3, 23rd Floor, Surian Tower, No 1, Jalan PJU 7/3, Mutiara Damansara, 47810 Petaling Jaya, Selangor"
,TM2025013706,29 April 2025,,,"Retail or wholesale services for stationery; retail services relating to stationery; wholesale services relating to stationery supplies. XORA ENTERPRISE SDN BHD; No.32, Jalan 2/2a, Taman Industri Selesa Jaya, 43300 Seri Kembangan, Selangor, MALAYSIA Bhd., No. 2928 & 2929, Jalan PJS 3/1, Bandar Petaling Jaya Selatan, 46000 Petaling Jaya, Selangor",,"Ooi Yeong Boon, Exy Intellectual Property Sdn. Bhd., No. 2928 & 2929, Jalan PJS 3/1, Bandar Petaling Jaya Selatan, 46000 Petaling Jaya, Selangor"
,TM2025014121,2 May 2025,,,"The first trademark in the series is limited to the colours as shown in the representation on the form of application. and wellness expo’. Business administration; Commercial administration of the licensing of the goods and services of others; Advertising and marketing services provided by means of social media; Advertising and commercial information services provided via the internet; Advertising in periodicals, brochures and newspapers; Online advertising on a computer network; Providing business information via a web site; Banner advertising; Distribution of flyers, brochures, printed matter and samples for advertising purposes; Advertising; Negotiation of commercial transactions for third parties; Advisory services relating to the operation of franchises; Business intermediary services relating to the matching of potential private investors with entrepreneurs needing funding; Business services, namely, matching potential private investors with entrepreneurs needing funding; Business and management consultancy services; Event marketing services; Conducting of commercial events; Event management services being conducting of commercial events; Organisation of commercial events; Organising and conducting of commercial events; Organising and conducting trade fairs, events and exhibitions for commercial or advertising purposes; Promotion of special events; Organizing and conducting trade fairs, events and exhibitions for commercial or advertising purposes; Planning and conducting of trade fairs, exhibitions and presentations for commercial or advertising purposes; Trade fair and commercial exhibition services; Trade show and commercial exhibition services; Organisation of exhibitions and trade fairs for business and promotional purposes; Arranging of trade fairs and exhibitions for commercial purposes; Arranging and conducting of fairs and exhibitions for business and advertising purposes. HEEPI MANAGEMENT SDN. BHD. ; No. 3, Jalan PU6/2, Taman Puchong Utama, 47100 Puchong, Selangor, MALAYSIA 3, Bandar Medini Iskandar, 79250 Iskandar Puteri, Johor",,"Low Chee Keong, IPMAN Global Intellect Sdn. Bhd. No. 3A-08, Hab Citrine, Persiaran Medini 3, Bandar Medini Iskandar, 79250 Iskandar Puteri, Johor"
,TM2025014429,6 May 2025,,,"Retail Store Services For Computer Hardware; Retail Store Services Featuring Computer Hardware; Retail Services Relating To Computer Hardware; Retail Services In Relation To Computer Hardware; Retail Services For Computer Hardware; Online Retail Store Services Featuring Computer Hardware; Online Retail Store Services Featuring Smartphones; Retail Services For Smartphones. EWT TECHNOLOGY SDN. BHD. ; Lot 2-18, 2-19, 2-20, 2- 21b, 2-22 & 2-23, Second Floor, Suria Sabah Shopping Mall, Jalan Tun Fuad Stephens, 88000 Kota Kinabalu, Sabah, MALAYSIA Block I, Persiaran Wawasan, Pusat Bandar Puchong, 47160 Puchong, Selangor",,"Thay Pee Ywai, NBS Intelectual Sdn. Bhd., I-3-3, Block I, Persiaran Wawasan, Pusat Bandar Puchong, 47160"
,TM2025014452,7 May 2025,,,"chinese character does not render any meaning together Online retail store services featuring foodstuffs; online wholesale store services featuring foodstuffs; on-line retail store services featuring foodstuffs; retail store services featuring foodstuffs; retail services for foodstuffs; retail services or wholesale services for food and beverages; wholesale store services for foodstuffs; food kiosk services being retail store services featuring foodstuffs; online wholesale store services featuring baked goods; retail store services for foodstuffs; wholesale services for foodstuffs; provision of an online marketplace for buyers and sellers of goods and services; retail or wholesale services for food and beverages. RAIJIN DINING SDN BHD; 80, Jalan Sultan, City Centre, 50000 Kuala Lumpur, MALAYSIA Bhd., No. 2928 & 2929, Jalan PJS 3/1, Bandar Petaling Jaya Selatan, 46000 Petaling Jaya, Selangor",,"Ooi Yeong Boon, Exy Intellectual Property Sdn. Bhd., No. 2928 & 2929, Jalan PJS 3/1, Bandar Petaling Jaya Selatan, 46000 Petaling Jaya, Selangor"
,TM2025014464,7 May 2025,,,"Advertising via electronic media; Advertising via mobile phone networks; Advertising via the internet; Advertising through all public communication means; Advertising the goods and services of online vendors via a searchable online guide; Commercial information and advice for consumers in the choice of products and services; Dissemination of advertising for others via an online electronic communications network; Dissemination of advertising material [leaflets, brochures and printed matter]; Electronic billboard advertising; Internet marketing; Online marketing; On-line customer-based social media brand marketing services; Promotion, advertising and marketing of on-line websites; Promoting the goods and services of others through advertisements on internet websites; Promoting the sale of goods and services of others through printed material; Providing commercial information and advice for consumers in the choice of products and services; Rental of signs for advertising purposes; Retail store services featuring headgear; Social media marketing; The bringing together, for the benefit of others, of a variety of goods, excluding the transport thereof, enabling customers to conveniently view and purchase those goods; Online retail store services featuring cosmetic and beauty products, clothing and accessories. NX HOLDINGS BERHAD; 9-B3 City Garden Commercial Centre, Taman Nirwana Ampang, Ampang 68000 Selangor, MALAYSIA Damansara, Jalan Damansara, Taman Tun Dr Ismail, 60000 Kuala Lumpur",,"Chong Yu Bin, PRIMUS IP Sdn Bhd,  13A-01, Oval Damansara, Jalan Damansara, Taman Tun Dr Ismail, 60000"
,TM2025014468,7 May 2025,,,"Advertising via electronic media; Advertising via mobile phone networks; Advertising via the internet; Advertising through all public communication means; Advertising the goods and services of online vendors via a searchable online guide; Commercial information and advice for consumers in the choice of products and services; Dissemination of advertising for others via an online electronic communications network; Dissemination of advertising material [leaflets, brochures and printed matter]; Electronic billboard advertising; Internet marketing; Online marketing; On-line customer-based social media brand marketing services; Promotion, advertising and marketing of on-line websites; Promoting the goods and services of others through advertisements on internet websites; Promoting the sale of goods and services of others through printed material; Providing commercial information and advice for consumers in the choice of products and services; Rental of signs for advertising purposes; Retail store services featuring headgear; Social media marketing; The bringing together, for the benefit of others, of a variety of goods, excluding the transport thereof, enabling customers to conveniently view and purchase those goods; Online retail store services featuring cosmetic and beauty products, clothing and accessories. NX HOLDINGS BERHAD; 9-B3 City Garden Commercial Centre, Taman Nirwana Ampang, 68000 Ampang, Selangor, MALAYSIA Damansara, Jalan Damansara, Taman Tun Dr Ismail, 60000 Kuala Lumpur",,"Chong Yu Bin, PRIMUS IP Sdn Bhd,  13A-01, Oval Damansara, Jalan Damansara, Taman Tun Dr Ismail, 60000"
,TM2025014780,8 May 2025,,,"Retail services for metal hardware; Online retail store services featuring metal hardware; Retail services relating to metal hardware; Retail store services featuring metal hardware. PERFECT METAL SOLUTION SDN. BHD. ; No 3,5 & 7, Jalan Bakawali 71, Taman Johor Jaya, Johor Bahru 81100 Johor, MALAYSIA Block C, Jalan Dataran SD 1 Dataran SD PJU 9, Bandar Sri Damansara, 52200 Kuala Lumpur",,"Yip Jiun Hann, TRADEMARK2U Sdn Bhd No. 1, Block C, Jalan Dataran SD 1 Dataran SD PJU 9, Bandar Sri Damansara, 52200 Kuala Lumpur"
,TM2025015038,9 May 2025,,,"Mark translaiteration: ""measure""; ""tranquil"". As a whole which has ni meaning Provision of an online marketplace for buyers and sellers of goods and services; Business auditing; Sponsorship search; Rental of sales stands; Outdoor advertising; Advertising; Business management and consultancy services; Commercial administration of the licensing of the goods and services of others; Import-export agency services; Sales promotion for others. HUANG YAN ; No. 401, Unit 1, Building D, Dongsi Renjia, Dongsi Street, Xishan District, Kunming City, Yunnan Province, CHINA Bhd., Unit 23.3, 23rd Floor, Surian Tower, No 1, Jalan PJU 7/3, Mutiara Damansara, 47810 Petaling Jaya, Selangor",,"Quality Oracle Sdn. Bhd., c/o Quality Oracle Sdn. Bhd., Unit 23.3, 23rd Floor, Surian Tower, No 1, Jalan PJU 7/3, Mutiara Damansara, 47810 Petaling Jaya, Selangor"
,TM2025015232,13 May 2025,,,"registration no: 2015060273 Administration of customer loyalty programs; Advertising services to create brand identity for others; Brand marketing services; Business management and marketing of brands for businesses and individuals; Marketing; On-line customer- based social media brand marketing services; Online advertising; Online marketing; Presentation of companies and their goods and services on the internet; Promotion, advertising and marketing of on-line websites; Providing advice in the field of business management and marketing; Providing marketing information via websites; Publicity and sales promotion relating to goods and services available on- line; Social media marketing; Social media marketing services. TAN SING KEE TRADING AS TSK OL ENTERPRISE ; No. 75, Kampung Baru Kalumpang, Hulu Selangor Kerling, 44100 Kerling, Selangor, MALAYSIA 10, Vertical Business Suites, No. 8, Jalan Kerinchi, Bangsar South, 59200 Kuala Lumpur",,"Phoon Chiy Hin , c/o CH Phoon & Associates, A-3- 10, Vertical Business Suites, No. 8, Jalan Kerinchi, Bangsar South, 59200 Kuala Lumpur"
,TM2025015379,14 May 2025,,,"On-line retail services for products via the web; On-line retail store services featuring seafood. WYNN WEBS SDN. BHD. ; No 2, Jalan Cj 1 / 6b, Kawasan Perindustrian Cheras Jaya, 43200 Cheras, Kuala Lumpur, MALAYSIA Block C, Jalan Dataran SD 1 Dataran SD PJU 9, Bandar Sri Damansara, 52200 Kuala Lumpur",,"Yip Jiun Hann, TRADEMARK2U Sdn Bhd No. 1, Block C, Jalan Dataran SD 1 Dataran SD PJU 9, Bandar Sri Damansara, 52200 Kuala Lumpur"
,TM2025027773,14 August 2025,,,"No colour claim exclusive use of the word ""residences"". Advertising of commercial or residential real estate; Advertising of real estate; Arranging and conducting of real estate auctions; Real estate marketing; Real estate sales management services; Assistance and consultancy relating to business management and organization; Business management and administration; Business project management; Commercial business management; Organization of exhibitions and trade fairs for commercial or advertising purposes; Marketing, market research and market analysis; Online advertising and marketing services; Personnel management consultancy; Providing and rental of advertising space; Publicity and sales promotion services; Office functions. GROUNDCON SDN. BHD.; Wisma Academy, 6.01, Jalan 19/1, Seksyen 19, 46300 Petaling Jaya, Selangor, MALAYSIA Sdn Bhd; Suite 13A-04, Wisma MCA, 163, Jalan Ampang, 50450 Kuala Lumpur",,"Neoh Kwok Khiang (Alex), Intellect Worldwide (KL) Sdn Bhd; Suite 13A-04, Wisma MCA, 163, Jalan Ampang, 50450 Kuala Lumpur"
,TM2021004671,22 February 2021,,,"2011015394, tm2020029154 & 2016066227. exclusive use of the word ‘mall’. Rental of real estate; Real estate management; Rent collection; Insurance, financial affairs, monetary affairs and real estate affairs; Leasing of shopping center space; Leasing of shopping mall space; Real estate management services relating to shopping malls. ECO MALL SDN. BHD. ; Lot 3913-3914, Kampung Sungai Siput, Segamat, 85200 Jementah, Johor, MALAYSIA Bhd. No. 19, Jalan SS1/36, 47300 Petaling Jaya, Selangor",,"Lok Choon Hong, Pintas Consulting Group Sdn. Bhd. No. 19, Jalan SS1/36, 47300 Petaling Jaya, Selangor"
,TM2025001421,14 January 2025,,,"representation on the form of application. Disclaimer: the word ""remit"". Administration of financial affairs; Administration of funds and investments; Automated payment services; Automated teller machine [atm] banking services; Bank card, credit card, debit card and electronic payment card services; Banking and financial services; Clearing and execution of financial securities transactions; Commercial banking services; Commercial lending services; Digital currency exchange services; E-wallet payment services; Electronic banking via a global computer network [internet banking]; Electronic commerce payment services; Electronic funds transfer and payment services; Debt management services; Financial management of funds; Financial services provided by electronic means; Financial, monetary and banking services; Financing and loan services; Foreign exchange transactions; Hire-purchase financing; Lease-purchase financing; Online banking services; Providing loan and credit facilities. KOPERASI CO-OPBANK PERTAMA MALAYSIA BERHAD ; CO-OPBANK PERTAMA, NO.27, TINGKAT 7, WISMA JCBNEXT, LORONG MEDAN TUANKU 1, OFF JALAN SULTAN ISMAIL, 50300 Kuala Lumpur, MALAYSIA Block 5, Laman Seri Business Park, Seksyen 13, Shah Alam 40100 Selangor",,"Norhana Binti Ramli, Hana Ramli & Co, Unit G33A, Block 5, Laman Seri Business Park, Seksyen 13, Shah Alam"
,TM2022004280,17 February 2022,,,"The second, third, fourth and fifth trade marks in the series are limited to the colours as shown in the representation on the form of application. exclusive use of a letter “a” and the word “auto” and “plus” separately. Motor vehicle maintenance and repair; Vehicle maintenance; Vehicle breakdown repair services; Vehicle washing; Car repair and maintenance; Garage services for the maintenance and repair of motor vehicles; Oil change services for vehicles; Reconditioning of automobiles; Tuning of motors and engines for automobiles. EXTREME MARKET PLACE SDN. BHD. ; No. 62-68, Jalan Ipoh, 51200 Kuala Lumpur, MALAYSIA 8th Floor, Wisma UOA Damansara 50 Jalan Dungun, Damansara Heights, 50490 Kuala Lumpur",,"Leela Devi A/P Baskaran, Skrine Unit No. 50-8-1, 8th Floor, Wisma UOA Damansara 50 Jalan Dungun, Damansara Heights, 50490 Kuala Lumpur"
,TM2025012187,18 April 2025,,,"Advisory services relating to the renovation of property; Commercial property construction; Construction of property; Construction, maintenance and renovation of property; Property construction; Advisory services relating to building construction; Advisory services relating to the construction of buildings and other structures; Apartment building construction; Building construction services; Building construction supervision services for real estate projects; Building construction supervision services relating to shopping centers, industrial complexes, office buildings, residential buildings and other real estate developments; Construction and maintenance of building complexes, residential buildings, housing estates, commercial buildings, shopping centers, office buildings and parking structures; Construction and maintenance of apartments, studios, bungalows, villas and cottages; Construction and repair of residential buildings and houses; Construction, repair and maintenance of buildings; Construction, repair and maintenance of buildings, and providing information relating thereto; Real estate development [building and construction services]. HAO DE LI SDN BHD ; No. 6-A, Lorong Bayu Tinggi 1B/KS 6, Batu Unjur, 41200 Klang, Selangor, MALAYSIA Office Ekocheras Office Suites, 693, Jalan Cheras, Batu 5, 56000 Cheras, Kuala Lumpur",,"Tee Lin Yik, Tee IP Sdn Bhd,  A-23-01, Penthouse Office Ekocheras Office Suites, 693, Jalan Cheras, Batu 5, 56000 Cheras, Kuala Lumpur"
